number,values_0,values_1,datetime_start,datetime_complete,duration,params_BN,params_aggregation,params_batch_size,params_depth,params_dropout_bond,params_dropout_ffn,params_hidden_bond,params_hidden_ffn,params_init_lr,params_layer,params_warmup_epochs,state
0,0.39667540412718155,0.3931652903556824,2024-12-18 16:41:56.354050,2024-12-18 16:53:55.484577,0 days 00:11:59.130527,True,norm,16,4,0.1,0.15000000000000002,700,200,0.0002374978777303647,1,2,COMPLETE
1,0.21474994086464638,0.43899795413017273,2024-12-18 16:53:55.525326,2024-12-18 17:03:11.615747,0 days 00:09:16.090421,False,norm,16,1,0.35000000000000003,0.35000000000000003,300,1600,0.0005409283346225766,1,10,COMPLETE
2,0.48276945999671333,0.31979259848594666,2024-12-18 17:03:11.651951,2024-12-18 17:13:54.745931,0 days 00:10:43.093980,True,norm,64,2,0.5,0.15000000000000002,600,1000,0.00047204338689235155,2,3,COMPLETE
3,,,2024-12-18 17:13:54.748941,2024-12-18 17:23:39.318418,0 days 00:09:44.569477,False,norm,32,2,0.4,0.05,800,1200,0.0003617232400744125,5,3,FAIL
4,0.3013977407965965,0.3832437992095947,2024-12-18 17:23:39.321727,2024-12-18 17:32:59.628903,0 days 00:09:20.307176,True,norm,64,5,0.5,0.5,200,200,0.0009063741129252553,1,4,COMPLETE
5,0.2513239575395487,0.578022301197052,2024-12-18 17:32:59.630493,2024-12-18 17:40:26.504634,0 days 00:07:26.874141,True,sum,64,2,0.1,0.45,1000,100,0.00016422924881059412,4,7,COMPLETE
6,,,2024-12-18 17:40:26.543837,2024-12-18 17:50:57.315008,0 days 00:10:30.771171,True,mean,32,2,0.0,0.0,800,1200,0.000392077360216756,5,3,FAIL
7,0.4516639731994085,0.341894268989563,2024-12-18 17:50:57.318519,2024-12-18 18:01:29.676488,0 days 00:10:32.357969,True,mean,64,5,0.1,0.5,1000,200,0.0007676610322455726,4,5,COMPLETE
8,0.2187028671388795,0.43981221318244934,2024-12-18 18:01:29.709031,2024-12-18 18:09:32.736412,0 days 00:08:03.027381,True,mean,64,4,0.45,0.25,300,1300,0.0004420568311507551,1,4,COMPLETE
9,0.0060488524633946,0.705009400844574,2024-12-18 18:09:32.737720,2024-12-18 18:16:23.790976,0 days 00:06:51.053256,True,sum,32,1,0.45,0.45,200,700,0.0004001500811790709,4,4,COMPLETE
10,0.37942862340326716,0.33720728754997253,2024-12-18 18:16:23.793242,2024-12-18 18:23:54.017584,0 days 00:07:30.224342,True,norm,64,3,0.4,0.35000000000000003,800,300,0.00013846115150135558,4,3,COMPLETE
11,0.4995575226512703,0.3267310559749603,2024-12-18 18:23:54.043328,2024-12-18 18:36:28.491200,0 days 00:12:34.447872,True,mean,32,5,0.30000000000000004,0.15000000000000002,1000,1100,0.0004791672629151842,2,5,COMPLETE
12,,,2024-12-18 18:36:28.492748,2024-12-18 18:46:14.733889,0 days 00:09:46.241141,False,mean,32,4,0.25,0.0,500,2000,0.0002606346316369596,3,7,FAIL
13,,,2024-12-18 18:46:14.738848,2024-12-18 18:54:16.428754,0 days 00:08:01.689906,False,mean,32,4,0.25,0.0,500,2000,0.0002840320695255996,3,7,FAIL
14,0.18719994699370063,0.554416298866272,2024-12-18 18:54:16.468535,2024-12-18 19:07:46.968864,0 days 00:13:30.500329,False,mean,32,4,0.25,0.0,500,1900,0.0002700445553300231,3,7,COMPLETE
15,0.32648188328312566,0.3511991798877716,2024-12-18 19:07:46.971715,2024-12-18 19:17:30.325523,0 days 00:09:43.353808,False,mean,128,2,0.25,0.1,600,900,0.0005934313141589046,2,6,COMPLETE
16,0.3040414823727133,0.34677761793136597,2024-12-18 19:17:30.327277,2024-12-18 19:24:57.082828,0 days 00:07:26.755551,True,mean,32,3,0.30000000000000004,0.15000000000000002,800,1100,0.0003512488806860696,2,9,COMPLETE
17,0.40887773894908813,0.35426846146583557,2024-12-18 19:24:57.111161,2024-12-18 19:32:28.312816,0 days 00:07:31.201655,True,sum,32,2,0.0,0.05,500,700,0.00010285658229189426,2,2,COMPLETE
18,0.10604801121501731,0.41603919863700867,2024-12-18 19:32:28.320430,2024-12-18 19:41:25.081572,0 days 00:08:56.761142,False,mean,128,3,0.35000000000000003,0.25,900,1400,0.0006136347899027668,3,6,COMPLETE
19,,,2024-12-18 19:41:25.083059,2024-12-18 19:51:37.460737,0 days 00:10:12.377678,True,norm,32,5,0.2,0.2,600,1000,0.0004529491246427431,5,8,FAIL
20,0.0687137059523938,0.5015171766281128,2024-12-18 19:51:37.462995,2024-12-18 20:01:02.234850,0 days 00:09:24.771855,True,norm,32,5,0.2,0.2,600,1000,0.0009895993515429532,5,8,COMPLETE
21,0.3961792499017814,0.3461192548274994,2024-12-18 20:01:02.237641,2024-12-18 20:12:20.108122,0 days 00:11:17.870481,True,mean,16,4,0.2,0.1,800,700,0.00046430753109192517,2,5,COMPLETE
22,0.21067818930216123,0.45098644495010376,2024-12-18 20:12:20.112099,2024-12-18 20:20:22.262862,0 days 00:08:02.150763,False,norm,128,2,0.5,0.35000000000000003,400,1600,0.0002830849444566874,3,3,COMPLETE
23,0.24534304269926055,0.35439422726631165,2024-12-18 20:20:22.267286,2024-12-18 20:27:19.854114,0 days 00:06:57.586828,True,sum,32,1,0.0,0.0,100,500,0.0003444891029663622,2,5,COMPLETE
24,,,2024-12-18 20:27:19.883567,2024-12-18 20:38:02.593611,0 days 00:10:42.710044,True,mean,32,5,0.35000000000000003,0.2,900,1200,0.0007765549001028579,5,3,FAIL
25,,,2024-12-18 20:38:02.598007,2024-12-18 20:47:42.663337,0 days 00:09:40.065330,True,mean,32,5,0.4,0.2,900,1200,0.0007118083548963937,5,3,FAIL
26,,,2024-12-18 20:47:42.666650,2024-12-18 20:59:18.024950,0 days 00:11:35.358300,True,mean,32,5,0.35000000000000003,0.2,900,1200,0.0007386399264288618,5,3,FAIL
27,,,2024-12-18 20:59:18.027869,2024-12-18 21:10:29.390686,0 days 00:11:11.362817,True,mean,32,5,0.4,0.2,900,1200,0.0007449301444430784,5,3,FAIL
28,,,2024-12-18 21:10:29.418782,2024-12-18 21:22:30.854285,0 days 00:12:01.435503,True,mean,32,5,0.4,0.2,900,1200,0.0005022188990642353,5,3,FAIL
29,0.12082265382176989,0.42884185910224915,2024-12-18 21:22:30.863539,2024-12-18 21:32:16.449465,0 days 00:09:45.585926,True,mean,32,5,0.4,0.2,900,1200,0.0006799397449962824,3,3,COMPLETE
30,0.10623204618497126,0.40836718678474426,2024-12-18 21:32:16.453358,2024-12-18 21:43:32.738371,0 days 00:11:16.285013,False,norm,64,3,0.15000000000000002,0.30000000000000004,700,1500,0.00048827311562289093,5,7,COMPLETE
31,0.13512611640530398,0.7493043541908264,2024-12-18 21:43:32.740221,2024-12-18 21:54:55.931182,0 days 00:11:23.190961,True,mean,64,5,0.35000000000000003,0.1,1000,2000,0.0007864404652467163,2,5,COMPLETE
32,0.008969692858704201,0.5957357287406921,2024-12-18 21:54:55.934289,2024-12-18 22:03:47.708849,0 days 00:08:51.774560,True,mean,32,5,0.30000000000000004,0.15000000000000002,1000,1800,0.0006877456622441321,3,5,COMPLETE
33,0.20342772549547686,0.39471572637557983,2024-12-18 22:03:47.711106,2024-12-18 22:10:53.100629,0 days 00:07:05.389523,True,norm,16,4,0.05,0.2,900,900,0.0004007416480585018,2,4,COMPLETE
34,0.3895273203095935,0.443063884973526,2024-12-18 22:10:53.102375,2024-12-18 22:18:52.259756,0 days 00:07:59.157381,True,mean,128,5,0.4,0.05,1000,1200,0.0005441903000173655,1,2,COMPLETE
35,0.4658269585056671,0.3439919948577881,2024-12-18 22:18:52.283687,2024-12-18 22:27:41.344173,0 days 00:08:49.060486,True,sum,64,4,0.45,0.25,900,400,0.0007918650057982726,2,6,COMPLETE
36,,,2024-12-18 22:27:41.374380,2024-12-18 22:34:50.461363,0 days 00:07:09.086983,False,sum,32,4,0.45,0.05,700,900,0.0004902785307102403,2,6,FAIL
37,,,2024-12-18 22:34:50.465815,2024-12-18 22:44:26.721111,0 days 00:09:36.255296,False,sum,32,4,0.45,0.05,700,500,0.000518566937930902,2,6,FAIL
38,,,2024-12-18 22:44:26.750677,2024-12-18 22:51:21.420794,0 days 00:06:54.670117,False,sum,32,4,0.45,0.05,700,900,0.0005172209566593911,2,6,FAIL
39,,,2024-12-18 22:51:21.423596,2024-12-18 22:58:27.164234,0 days 00:07:05.740638,False,sum,32,4,0.45,0.05,700,500,0.0003204379243421638,2,6,FAIL
40,,,2024-12-18 22:58:27.166823,2024-12-18 23:06:04.637150,0 days 00:07:37.470327,False,sum,32,4,0.45,0.05,700,500,0.0004848682348841301,2,6,FAIL
41,,,2024-12-18 23:06:04.668305,2024-12-18 23:17:34.765453,0 days 00:11:30.097148,False,sum,32,4,0.45,0.05,700,500,0.0005031309052943809,2,6,FAIL
42,,,2024-12-18 23:17:34.767250,2024-12-18 23:25:59.582574,0 days 00:08:24.815324,False,sum,32,4,0.45,0.05,700,900,0.0005248102758096806,2,6,FAIL
43,,,2024-12-18 23:25:59.584332,2024-12-18 23:33:57.086450,0 days 00:07:57.502118,False,sum,32,4,0.45,0.05,700,500,0.0005065401419350795,2,6,FAIL
44,,,2024-12-18 23:33:57.090562,2024-12-18 23:42:16.205805,0 days 00:08:19.115243,False,sum,32,4,0.45,0.05,700,900,0.0003825869577680702,2,6,FAIL
45,,,2024-12-18 23:42:16.209076,2024-12-18 23:50:03.074481,0 days 00:07:46.865405,False,sum,32,4,0.45,0.05,700,500,0.00038336600193590554,2,6,FAIL
46,,,2024-12-18 23:50:03.076989,2024-12-18 23:58:43.942517,0 days 00:08:40.865528,False,sum,32,4,0.45,0.05,700,500,0.0005212783238316195,2,6,FAIL
47,,,2024-12-18 23:58:43.967313,2024-12-19 00:08:58.592866,0 days 00:10:14.625553,False,sum,32,4,0.45,0.05,700,900,0.0005174200908595979,2,6,FAIL
48,,,2024-12-19 00:08:58.594708,2024-12-19 00:21:03.641745,0 days 00:12:05.047037,False,sum,32,4,0.45,0.05,700,500,0.0005038359821017512,2,6,FAIL
49,,,2024-12-19 00:21:03.667059,2024-12-19 00:28:03.137310,0 days 00:06:59.470251,False,sum,32,4,0.45,0.05,700,500,0.0004885514078423053,2,6,FAIL
50,,,2024-12-19 00:28:03.164566,2024-12-19 00:36:56.737989,0 days 00:08:53.573423,False,sum,32,4,0.45,0.05,700,900,0.00022497289725248134,2,6,FAIL
51,,,2024-12-19 00:36:56.740593,2024-12-19 00:44:30.384666,0 days 00:07:33.644073,False,sum,32,4,0.45,0.05,700,500,0.0005198890682871282,2,6,FAIL
52,,,2024-12-19 00:44:30.394489,2024-12-19 00:51:56.013418,0 days 00:07:25.618929,False,sum,32,4,0.45,0.05,700,500,0.00032815926161999283,2,6,FAIL
53,,,2024-12-19 00:51:56.033516,2024-12-19 00:59:50.674844,0 days 00:07:54.641328,False,sum,32,4,0.45,0.05,700,900,0.0005107180837744469,2,8,FAIL
54,,,2024-12-19 00:59:50.676934,2024-12-19 01:06:57.283837,0 days 00:07:06.606903,False,sum,32,4,0.45,0.05,700,500,0.00047717104851067457,2,8,FAIL
55,,,2024-12-19 01:06:57.287440,2024-12-19 01:16:03.888491,0 days 00:09:06.601051,False,sum,32,4,0.45,0.05,700,1000,0.0004925424505656529,2,6,FAIL
56,0.11844307418328452,0.5117601156234741,2024-12-19 01:16:03.891546,2024-12-19 01:25:21.287563,0 days 00:09:17.396017,False,sum,32,4,0.45,0.05,700,500,0.0004881684131244681,2,6,COMPLETE
57,0.288186255551781,0.5615986585617065,2024-12-19 01:25:21.291178,2024-12-19 01:36:33.356852,0 days 00:11:12.065674,True,mean,32,2,0.5,0.30000000000000004,900,900,0.0003179121258297635,1,8,COMPLETE
58,0.09774486183734615,0.39506280422210693,2024-12-19 01:36:33.359086,2024-12-19 01:47:04.448854,0 days 00:10:31.089768,True,norm,64,3,0.30000000000000004,0.15000000000000002,800,1100,0.00037622772490320704,3,3,COMPLETE
59,0.28609937888672926,0.6045668721199036,2024-12-19 01:47:04.460047,2024-12-19 01:59:43.390520,0 days 00:12:38.930473,True,norm,16,5,0.2,0.25,700,1400,0.00023309121099438483,1,2,COMPLETE
60,,,2024-12-19 01:59:43.394815,2024-12-19 02:10:58.975684,0 days 00:11:15.580869,False,sum,128,4,0.15000000000000002,0.1,900,500,0.00041977899664565114,2,8,FAIL
61,0.05629789340181233,5.8325910568237305,2024-12-19 02:10:58.979328,2024-12-19 02:23:44.170995,0 days 00:12:45.191667,False,sum,128,4,0.15000000000000002,0.1,900,1700,0.0004263545087690025,2,10,COMPLETE
62,0.5338134015365195,0.3044205904006958,2024-12-19 02:23:44.174573,2024-12-19 02:34:19.970547,0 days 00:10:35.795974,True,norm,64,3,0.4,0.2,600,600,0.0005323655715246858,2,3,COMPLETE
63,0.3859462388339947,0.3399927020072937,2024-12-19 02:34:19.996920,2024-12-19 02:46:12.760189,0 days 00:11:52.763269,False,norm,64,3,0.35000000000000003,0.2,500,500,0.0005386716097562904,5,2,COMPLETE
64,0.4401268541455253,0.36074692010879517,2024-12-19 02:46:12.791024,2024-12-19 02:56:39.626235,0 days 00:10:26.835211,True,norm,64,3,0.4,0.30000000000000004,400,400,0.0008028997305199838,1,3,COMPLETE
65,0.23145351335312733,0.36344996094703674,2024-12-19 02:56:39.628337,2024-12-19 03:04:26.845836,0 days 00:07:47.217499,False,norm,64,1,0.45,0.25,400,600,0.0006093054458500269,3,9,COMPLETE
66,0.2944093926900108,0.3665854334831238,2024-12-19 03:04:26.874101,2024-12-19 03:14:22.443846,0 days 00:09:55.569745,True,norm,64,2,0.35000000000000003,0.4,100,300,0.00021424717627195592,1,4,COMPLETE
67,0.33384878889282305,0.3547198474407196,2024-12-19 03:14:22.470753,2024-12-19 03:23:48.448989,0 days 00:09:25.978236,True,norm,16,2,0.5,0.2,300,100,0.0008336033067730543,4,4,COMPLETE
68,0.23800186249675584,0.3697566092014313,2024-12-19 03:23:48.452160,2024-12-19 03:34:01.273770,0 days 00:10:12.821610,True,norm,64,4,0.30000000000000004,0.35000000000000003,600,800,0.000901219358328669,4,2,COMPLETE
69,0.2639518771578176,0.36179205775260925,2024-12-19 03:34:01.280003,2024-12-19 03:43:05.696845,0 days 00:09:04.416842,True,norm,64,1,0.45,0.45,300,300,0.0006818602516842607,2,3,COMPLETE
70,0.2017199180859098,0.4490780830383301,2024-12-19 03:43:05.704380,2024-12-19 03:49:52.249508,0 days 00:06:46.545128,False,sum,64,3,0.4,0.30000000000000004,200,600,0.00018090236107357115,1,10,COMPLETE
71,0.24039441185491234,0.37616288661956787,2024-12-19 03:49:52.252308,2024-12-19 03:57:08.840937,0 days 00:07:16.588629,True,norm,64,2,0.05,0.5,600,100,0.0004314218060866259,3,4,COMPLETE
72,0.5350543228390421,0.30620068311691284,2024-12-19 03:57:08.843830,2024-12-19 04:06:40.469712,0 days 00:09:31.625882,True,norm,64,3,0.4,0.15000000000000002,500,300,0.0005173718787198814,4,3,COMPLETE
73,0.3880310855257515,0.37126147747039795,2024-12-19 04:06:40.472867,2024-12-19 04:14:45.025234,0 days 00:08:04.552367,True,norm,64,3,0.45,0.15000000000000002,500,400,0.0005324786199826604,5,3,COMPLETE
74,0.4615198995942519,0.31777235865592957,2024-12-19 04:14:45.028422,2024-12-19 04:22:32.475064,0 days 00:07:47.446642,True,norm,64,4,0.4,0.2,400,200,0.0003927297757135963,4,3,COMPLETE
75,0.4078831922555364,0.3308510184288025,2024-12-19 04:22:32.489102,2024-12-19 04:31:32.877127,0 days 00:09:00.388025,True,norm,64,3,0.35000000000000003,0.2,200,200,0.0003821899244415692,4,3,COMPLETE
76,0.0776025854000315,0.4555671513080597,2024-12-19 04:31:32.885346,2024-12-19 04:41:43.116068,0 days 00:10:10.230722,True,norm,16,3,0.4,0.15000000000000002,400,800,0.00028038163612127004,4,2,COMPLETE
77,0.5751806511969403,0.27616897225379944,2024-12-19 04:41:43.120961,2024-12-19 04:51:42.535960,0 days 00:09:59.414999,True,norm,64,2,0.25,0.1,500,600,0.00045567923190541323,3,4,COMPLETE
78,0.2167342335595002,0.3699280619621277,2024-12-19 04:51:42.540378,2024-12-19 05:02:31.944704,0 days 00:10:49.404326,False,sum,128,1,0.25,0.05,500,1000,0.00010884672433128948,3,4,COMPLETE
79,0.33076044509796604,0.4350709915161133,2024-12-19 05:02:31.949416,2024-12-19 05:13:23.941170,0 days 00:10:51.991754,False,norm,16,1,0.15000000000000002,0.0,600,700,0.0002999593439763739,3,5,COMPLETE
80,0.35575428535768244,0.34073391556739807,2024-12-19 05:13:23.943477,2024-12-19 05:23:52.843719,0 days 00:10:28.900242,True,norm,128,2,0.25,0.1,500,600,0.00014224538938411237,4,5,COMPLETE
81,0.18092637799721883,0.38575780391693115,2024-12-19 05:23:52.878318,2024-12-19 05:43:10.398568,0 days 00:19:17.520250,False,sum,64,1,0.25,0.05,600,800,0.00026395256677797543,4,9,COMPLETE
82,0.2855028837551492,0.4003494679927826,2024-12-19 05:43:10.434943,2024-12-19 05:51:38.357580,0 days 00:08:27.922637,True,norm,64,2,0.2,0.1,400,600,0.0003367877520734998,4,4,COMPLETE
83,0.5202424830063026,0.29851627349853516,2024-12-19 05:51:38.361071,2024-12-19 06:01:51.883910,0 days 00:10:13.522839,True,norm,64,2,0.2,0.0,500,800,0.0004441969867375143,3,8,COMPLETE
84,0.4107293100576012,0.3678632378578186,2024-12-19 06:01:51.918249,2024-12-19 06:10:09.191324,0 days 00:08:17.273075,True,norm,64,2,0.2,0.0,500,700,0.00043453896235113513,3,7,COMPLETE
85,0.4907186737298873,0.3088032305240631,2024-12-19 06:10:09.195202,2024-12-19 06:21:14.707272,0 days 00:11:05.512070,True,mean,128,2,0.30000000000000004,0.45,700,500,0.00035022242553513254,5,4,COMPLETE
86,0.30266931999359975,0.38471895456314087,2024-12-19 06:21:14.732727,2024-12-19 06:28:53.091902,0 days 00:07:38.359175,True,mean,16,2,0.30000000000000004,0.4,300,500,0.0003684511305300447,3,5,COMPLETE
87,0.09198695595315454,0.4728025794029236,2024-12-19 06:28:53.100129,2024-12-19 06:39:03.369798,0 days 00:10:10.269669,False,norm,128,2,0.25,0.05,700,2000,0.00046002130437237503,5,8,COMPLETE
88,0.36766986544946423,0.43116605281829834,2024-12-19 06:39:03.395439,2024-12-19 06:45:42.502373,0 days 00:06:39.106934,True,sum,64,2,0.1,0.0,600,900,0.0003149715821111892,3,5,COMPLETE
89,0.42983437601351515,0.3511389195919037,2024-12-19 06:45:42.505726,2024-12-19 06:53:14.846528,0 days 00:07:32.340802,True,norm,64,2,0.25,0.1,400,400,0.00034301351419518136,5,4,COMPLETE
90,0.23619016910472976,0.5242855548858643,2024-12-19 06:53:14.877155,2024-12-19 07:00:03.096744,0 days 00:06:48.219589,False,mean,32,1,0.15000000000000002,0.4,500,800,0.000510647600733229,3,6,COMPLETE
91,0.5291888144562064,0.29641851782798767,2024-12-19 07:00:03.100236,2024-12-19 07:10:47.505613,0 days 00:10:44.405377,True,norm,128,2,0.2,0.15000000000000002,500,1800,0.0005938564883871442,2,4,COMPLETE
92,0.3836014942104988,0.3507080078125,2024-12-19 07:10:47.507086,2024-12-19 07:18:08.395593,0 days 00:07:20.888507,True,norm,64,2,0.2,0.15000000000000002,500,1800,0.0005769293125559063,2,4,COMPLETE
93,0.29706397280927876,0.3891512155532837,2024-12-19 07:18:08.426505,2024-12-19 07:26:12.652550,0 days 00:08:04.226045,True,sum,128,2,0.30000000000000004,0.45,100,600,0.0004897380584963715,3,4,COMPLETE
94,0.31172921481474053,0.3508512079715729,2024-12-19 07:26:12.654076,2024-12-19 07:32:37.319896,0 days 00:06:24.665820,True,mean,16,2,0.05,0.1,500,700,0.0004184582652537622,2,5,COMPLETE
95,0.14337389674573692,0.40971484780311584,2024-12-19 07:32:37.323863,2024-12-19 07:40:02.058556,0 days 00:07:24.734693,True,norm,32,2,0.25,0.05,800,1300,0.0004667949340286148,4,7,COMPLETE
96,0.3005892462308773,0.3857927620410919,2024-12-19 07:40:02.062971,2024-12-19 07:48:06.738547,0 days 00:08:04.675576,False,norm,64,2,0.30000000000000004,0.15000000000000002,600,1600,0.0007050707199366144,3,9,COMPLETE
97,0.41650866206127557,0.3044399619102478,2024-12-19 07:48:06.751086,2024-12-19 07:55:22.962952,0 days 00:07:16.211866,True,mean,64,1,0.0,0.0,400,500,0.0006269480542638624,4,4,COMPLETE
98,0.32530346072099287,0.3531801104545593,2024-12-19 07:55:22.976256,2024-12-19 08:02:50.524275,0 days 00:07:27.548019,True,norm,128,2,0.2,0.1,300,1900,0.00039554326091122165,2,6,COMPLETE
99,0.11655055433474522,0.3791294991970062,2024-12-19 08:02:50.552506,2024-12-19 08:09:38.343518,0 days 00:06:47.791012,False,sum,32,1,0.25,0.35000000000000003,700,300,0.0005673123953668085,5,3,COMPLETE
