number,values_0,values_1,datetime_start,datetime_complete,duration,params_BN,params_aggregation,params_batch_size,params_depth,params_dropout_bond,params_dropout_ffn,params_hidden_bond,params_hidden_ffn,params_init_lr,params_layer,params_warmup_epochs,state
0,0.49936568905791284,0.43222278356552124,2024-12-17 09:54:02.427306,2024-12-17 09:59:04.309310,0 days 00:05:01.882004,False,norm,32,1,0.1,0.45,700,1500,0.0007544792537800734,1,4,COMPLETE
1,,,2024-12-17 09:59:04.310530,2024-12-17 10:04:50.995111,0 days 00:05:46.684581,True,mean,32,5,0.1,0.0,100,1500,0.0006428041427636123,5,7,FAIL
2,0.4044667334723892,0.5396512150764465,2024-12-17 10:04:50.996403,2024-12-17 10:10:27.212624,0 days 00:05:36.216221,True,mean,128,4,0.05,0.4,500,1200,0.0004617388874767109,3,4,COMPLETE
3,0.5537461546846606,0.42936810851097107,2024-12-17 10:10:27.214327,2024-12-17 10:14:49.742570,0 days 00:04:22.528243,True,sum,64,4,0.35000000000000003,0.05,400,800,0.00039840599953376414,2,5,COMPLETE
4,0.4470912111541189,0.4418726861476898,2024-12-17 10:14:49.744464,2024-12-17 10:20:05.103303,0 days 00:05:15.358839,True,mean,128,3,0.25,0.1,400,100,0.00024244540633849105,2,7,COMPLETE
5,0.3409179311804753,0.5555911660194397,2024-12-17 10:20:05.104692,2024-12-17 10:26:31.719005,0 days 00:06:26.614313,True,norm,32,2,0.15000000000000002,0.5,400,1900,0.00024139383156224589,2,6,COMPLETE
6,0.4084330893975763,0.7637160420417786,2024-12-17 10:26:31.720390,2024-12-17 10:31:54.495934,0 days 00:05:22.775544,True,norm,128,5,0.2,0.35000000000000003,700,800,0.000907243114813481,4,5,COMPLETE
7,0.538962356590869,0.4320896863937378,2024-12-17 10:31:54.497730,2024-12-17 10:40:02.972628,0 days 00:08:08.474898,False,norm,32,1,0.15000000000000002,0.5,800,1900,0.00012956632038483253,2,5,COMPLETE
8,0.47062654146364535,0.532566487789154,2024-12-17 10:40:02.974544,2024-12-17 10:44:19.583649,0 days 00:04:16.609105,True,norm,128,5,0.1,0.4,400,300,0.0001903385850391049,4,10,COMPLETE
9,0.6415969326983951,0.3470630645751953,2024-12-17 10:44:19.585086,2024-12-17 10:50:56.459503,0 days 00:06:36.874417,False,norm,32,3,0.25,0.35000000000000003,200,600,0.00016478577943685756,1,4,COMPLETE
10,0.7047267977486525,0.3284549117088318,2024-12-17 10:50:56.461532,2024-12-17 10:58:16.697975,0 days 00:07:20.236443,False,norm,16,5,0.0,0.4,600,1400,0.00021528518356074403,1,3,COMPLETE
11,,,2024-12-17 10:58:16.699303,2024-12-17 11:03:15.921369,0 days 00:04:59.222066,False,sum,16,4,0.5,0.2,1000,1300,0.00010384620022114862,5,2,FAIL
12,,,2024-12-17 11:03:15.924879,2024-12-17 11:13:24.547426,0 days 00:10:08.622547,False,sum,16,4,0.5,0.2,1000,1400,0.00011682674532315393,5,2,FAIL
13,,,2024-12-17 11:13:24.549290,2024-12-17 11:19:37.261810,0 days 00:06:12.712520,False,sum,16,4,0.5,0.2,1000,1400,0.00010630405244451251,5,2,FAIL
14,,,2024-12-17 11:19:37.263777,2024-12-17 11:25:37.477705,0 days 00:06:00.213928,False,sum,16,4,0.5,0.2,1000,1300,0.00011164633298729463,5,2,FAIL
15,,,2024-12-17 11:25:37.480022,2024-12-17 11:33:06.626115,0 days 00:07:29.146093,False,sum,16,4,0.5,0.2,1000,1400,0.00010527131630501106,5,2,FAIL
16,,,2024-12-17 11:33:06.628573,2024-12-17 11:43:32.667366,0 days 00:10:26.038793,False,sum,16,4,0.45,0.2,1000,1400,0.0001035173819783532,5,2,FAIL
17,,,2024-12-17 11:43:32.671779,2024-12-17 11:52:01.964807,0 days 00:08:29.293028,False,sum,16,4,0.45,0.2,1000,1400,0.00013836319752268692,5,2,FAIL
18,,,2024-12-17 11:52:01.970227,2024-12-17 12:00:47.485516,0 days 00:08:45.515289,False,sum,16,4,0.5,0.2,1000,1400,0.00010523897663781223,3,2,FAIL
19,,,2024-12-17 12:00:47.488178,2024-12-17 12:12:27.650258,0 days 00:11:40.162080,False,sum,16,4,0.5,0.2,1000,1300,0.00010873918328619533,5,2,FAIL
20,,,2024-12-17 12:12:27.653408,2024-12-17 12:26:57.096061,0 days 00:14:29.442653,False,sum,16,4,0.45,0.2,1000,1400,0.0001004313688216179,5,2,FAIL
21,,,2024-12-17 12:26:57.134238,2024-12-17 12:37:47.455940,0 days 00:10:50.321702,False,sum,16,4,0.45,0.25,1000,1400,0.00010251121222352366,5,2,FAIL
22,,,2024-12-17 12:37:47.490626,2024-12-17 12:46:42.791447,0 days 00:08:55.300821,False,sum,16,4,0.5,0.2,1000,1400,0.00010864551703552597,5,2,FAIL
23,,,2024-12-17 12:46:42.793517,2024-12-17 13:00:01.595986,0 days 00:13:18.802469,False,sum,16,4,0.45,0.2,1000,1400,0.00010038921061431241,5,2,FAIL
24,,,2024-12-17 13:00:01.628251,2024-12-17 13:08:35.430710,0 days 00:08:33.802459,False,sum,16,4,0.0,0.2,900,1400,0.0001007422650777384,5,2,FAIL
25,,,2024-12-17 13:08:35.432693,2024-12-17 13:17:54.408199,0 days 00:09:18.975506,False,sum,16,4,0.5,0.2,1000,1400,0.00010333202195904048,3,8,FAIL
26,,,2024-12-17 13:17:54.411168,2024-12-17 13:30:09.193528,0 days 00:12:14.782360,False,sum,16,4,0.45,0.2,1000,1400,0.00011935966636137361,5,2,FAIL
27,,,2024-12-17 13:30:09.224579,2024-12-17 13:40:31.082406,0 days 00:10:21.857827,False,sum,16,4,0.45,0.2,1000,1300,0.00010055388895855005,5,2,FAIL
28,,,2024-12-17 13:40:31.090848,2024-12-17 13:50:17.966175,0 days 00:09:46.875327,False,sum,16,4,0.5,0.2,1000,1300,0.00010131464462293687,5,2,FAIL
29,,,2024-12-17 13:50:18.005389,2024-12-17 13:58:24.003600,0 days 00:08:05.998211,False,sum,16,4,0.45,0.2,1000,1400,0.00011166477308358041,5,2,FAIL
30,,,2024-12-17 13:58:24.005866,2024-12-17 14:07:49.603891,0 days 00:09:25.598025,False,sum,16,4,0.5,0.2,1000,1400,0.00010245807305806994,5,2,FAIL
31,,,2024-12-17 14:07:49.606282,2024-12-17 14:16:11.256178,0 days 00:08:21.649896,False,sum,16,4,0.45,0.2,1000,1400,0.00010172279693434232,5,2,FAIL
32,,,2024-12-17 14:16:11.258367,2024-12-17 14:24:54.317260,0 days 00:08:43.058893,False,sum,16,4,0.5,0.2,1000,1400,0.00011219117169828251,5,2,FAIL
33,,,2024-12-17 14:24:54.319271,2024-12-17 14:36:07.977681,0 days 00:11:13.658410,False,sum,16,4,0.45,0.2,900,1400,0.0001127078915761695,5,2,FAIL
34,,,2024-12-17 14:36:07.979442,2024-12-17 14:45:49.071514,0 days 00:09:41.092072,False,sum,16,4,0.5,0.2,1000,1400,0.00010231702525465444,5,2,FAIL
35,,,2024-12-17 14:45:49.073933,2024-12-17 14:56:02.212516,0 days 00:10:13.138583,False,sum,16,4,0.5,0.2,1000,1400,0.00011370923536710758,5,2,FAIL
36,,,2024-12-17 14:56:02.214401,2024-12-17 15:04:39.447911,0 days 00:08:37.233510,False,sum,16,4,0.5,0.2,1000,1400,0.00010048350104074083,3,2,FAIL
37,,,2024-12-17 15:04:39.450008,2024-12-17 15:13:08.954439,0 days 00:08:29.504431,False,sum,16,4,0.5,0.25,1000,1400,0.00010702286349053696,5,2,FAIL
38,,,2024-12-17 15:13:08.957099,2024-12-17 15:21:53.478881,0 days 00:08:44.521782,False,sum,16,4,0.5,0.2,1000,1400,0.000106594784640084,5,2,FAIL
39,,,2024-12-17 15:21:53.481227,2024-12-17 15:32:11.867596,0 days 00:10:18.386369,False,sum,16,4,0.0,0.2,1000,1400,0.00010187720408644706,5,2,FAIL
40,,,2024-12-17 15:32:11.869649,2024-12-17 15:39:14.997677,0 days 00:07:03.128028,False,sum,16,4,0.5,0.2,1000,1400,0.00030895771197093723,5,2,FAIL
41,,,2024-12-17 15:39:14.999680,2024-12-17 15:51:22.749633,0 days 00:12:07.749953,False,sum,16,4,0.0,0.2,1000,1400,0.0001100518075432649,5,2,FAIL
42,,,2024-12-17 15:51:22.753689,2024-12-17 16:03:22.874653,0 days 00:12:00.120964,False,sum,16,4,0.45,0.2,900,1400,0.00011789131913788956,5,2,FAIL
43,,,2024-12-17 16:03:22.877452,2024-12-17 16:11:29.440960,0 days 00:08:06.563508,False,sum,16,4,0.5,0.25,1000,1400,0.00011132371778812107,5,9,FAIL
44,,,2024-12-17 16:11:29.456823,2024-12-17 16:22:28.366756,0 days 00:10:58.909933,False,sum,16,4,0.5,0.2,900,1500,0.00010852895255152803,5,2,FAIL
45,,,2024-12-17 16:22:28.368990,2024-12-17 16:33:25.032309,0 days 00:10:56.663319,False,sum,16,4,0.5,0.2,900,1400,0.00010573385696182393,5,2,FAIL
46,,,2024-12-17 16:33:25.035037,2024-12-17 16:41:21.226002,0 days 00:07:56.190965,False,sum,16,4,0.45,0.2,1000,1300,0.0001165024748665915,5,2,FAIL
47,,,2024-12-17 16:41:21.231019,2024-12-17 16:50:44.834387,0 days 00:09:23.603368,False,sum,16,4,0.5,0.2,1000,1400,0.00010665794867424016,5,2,FAIL
48,,,2024-12-17 16:50:44.836825,2024-12-17 17:03:35.486215,0 days 00:12:50.649390,False,sum,16,4,0.5,0.25,1000,1400,0.00010415258017782632,5,2,FAIL
49,,,2024-12-17 17:03:35.510943,2024-12-17 17:11:56.456170,0 days 00:08:20.945227,False,sum,16,4,0.5,0.2,1000,1400,0.00010194293052284073,5,2,FAIL
50,,,2024-12-17 17:11:56.461561,2024-12-17 17:26:19.615491,0 days 00:14:23.153930,False,sum,16,4,0.5,0.2,1000,1400,0.00010785268814579502,5,2,FAIL
51,,,2024-12-17 17:26:19.617396,2024-12-17 17:40:59.138467,0 days 00:14:39.521071,False,sum,16,4,0.5,0.25,1000,1400,0.0001177387555497911,5,2,FAIL
52,,,2024-12-17 17:40:59.145291,2024-12-17 17:50:23.132896,0 days 00:09:23.987605,False,sum,16,4,0.5,0.2,1000,1400,0.00010587335088401449,5,2,FAIL
53,,,2024-12-17 17:50:23.166563,2024-12-17 18:01:38.906038,0 days 00:11:15.739475,False,sum,16,4,0.45,0.2,1000,1300,0.00010060474622545728,5,2,FAIL
54,0.051059550484026356,2.8183209896087646,2024-12-17 18:01:38.909268,2024-12-17 18:12:13.181804,0 days 00:10:34.272536,False,sum,16,4,0.5,0.25,1000,1400,0.00010229608181868187,5,2,COMPLETE
55,0.6602464709907362,0.3686351478099823,2024-12-17 18:12:13.184821,2024-12-17 18:21:07.352629,0 days 00:08:54.167808,False,norm,16,3,0.0,0.25,100,1600,0.00016459796671242086,1,2,COMPLETE
56,0.5034452061994039,0.44158104062080383,2024-12-17 18:21:07.356255,2024-12-17 18:30:15.985451,0 days 00:09:08.629196,False,mean,16,5,0.35000000000000003,0.30000000000000004,100,1000,0.0003072815077746044,1,3,COMPLETE
57,,,2024-12-17 18:30:15.987227,2024-12-17 18:38:55.267611,0 days 00:08:39.280384,False,sum,16,3,0.35000000000000003,0.2,1000,1200,0.00016603703734135487,3,8,FAIL
58,,,2024-12-17 18:38:55.269482,2024-12-17 18:45:38.884286,0 days 00:06:43.614804,False,sum,16,3,0.35000000000000003,0.15000000000000002,1000,500,0.00016124386911437632,3,8,FAIL
59,,,2024-12-17 18:45:38.886047,2024-12-17 18:57:34.355629,0 days 00:11:55.469582,False,sum,16,3,0.35000000000000003,0.15000000000000002,1000,500,0.00017353473280202269,3,8,FAIL
60,,,2024-12-17 18:57:34.357505,2024-12-17 19:04:45.737083,0 days 00:07:11.379578,False,sum,16,3,0.35000000000000003,0.15000000000000002,1000,500,0.00017986664769251867,3,8,FAIL
61,,,2024-12-17 19:04:45.757288,2024-12-17 19:13:58.721733,0 days 00:09:12.964445,False,sum,16,3,0.35000000000000003,0.15000000000000002,1000,600,0.0001572247398048774,3,8,FAIL
62,,,2024-12-17 19:13:58.745300,2024-12-17 19:21:25.120031,0 days 00:07:26.374731,False,sum,16,3,0.35000000000000003,0.15000000000000002,1000,500,0.00015959992858716665,3,8,FAIL
63,,,2024-12-17 19:21:25.132186,2024-12-17 19:32:29.405776,0 days 00:11:04.273590,False,sum,16,3,0.35000000000000003,0.15000000000000002,1000,600,0.0001597518555513642,3,8,FAIL
64,,,2024-12-17 19:32:29.409204,2024-12-17 19:41:45.492568,0 days 00:09:16.083364,False,sum,16,3,0.35000000000000003,0.15000000000000002,1000,600,0.00016485081405229201,3,8,FAIL
65,,,2024-12-17 19:41:45.523933,2024-12-17 19:51:07.642590,0 days 00:09:22.118657,False,sum,16,3,0.35000000000000003,0.15000000000000002,1000,1200,0.00016229396693025213,3,8,FAIL
66,,,2024-12-17 19:51:07.649810,2024-12-17 19:59:22.859005,0 days 00:08:15.209195,False,sum,16,3,0.35000000000000003,0.15000000000000002,1000,600,0.00016797236756689956,3,8,FAIL
67,,,2024-12-17 19:59:22.860181,2024-12-17 20:08:22.927952,0 days 00:09:00.067771,False,sum,16,3,0.0,0.15000000000000002,1000,1100,0.00016574843992133093,3,8,FAIL
68,,,2024-12-17 20:08:22.933520,2024-12-17 20:15:21.734233,0 days 00:06:58.800713,False,sum,16,3,0.35000000000000003,0.15000000000000002,1000,500,0.00016463998158738725,3,8,FAIL
69,,,2024-12-17 20:15:21.736560,2024-12-17 20:24:29.202423,0 days 00:09:07.465863,False,sum,16,3,0.35000000000000003,0.15000000000000002,1000,500,0.00015868640799578075,3,8,FAIL
70,,,2024-12-17 20:24:29.205033,2024-12-17 20:34:16.204750,0 days 00:09:46.999717,False,sum,16,3,0.35000000000000003,0.15000000000000002,900,600,0.0001608530723373599,3,8,FAIL
71,,,2024-12-17 20:34:16.206650,2024-12-17 20:42:56.561486,0 days 00:08:40.354836,False,sum,16,3,0.0,0.15000000000000002,1000,500,0.00015766221631626024,3,8,FAIL
72,,,2024-12-17 20:42:56.564186,2024-12-17 20:50:48.827506,0 days 00:07:52.263320,False,sum,16,3,0.35000000000000003,0.2,1000,500,0.00017652261463156952,3,8,FAIL
73,,,2024-12-17 20:50:48.864136,2024-12-17 20:58:25.749276,0 days 00:07:36.885140,False,sum,16,3,0.35000000000000003,0.15000000000000002,1000,500,0.00017606123335954204,3,8,FAIL
74,,,2024-12-17 20:58:25.786012,2024-12-17 21:06:48.049566,0 days 00:08:22.263554,False,sum,16,3,0.35000000000000003,0.15000000000000002,1000,500,0.0001635375017347184,3,8,FAIL
75,,,2024-12-17 21:06:48.053492,2024-12-17 21:16:51.596681,0 days 00:10:03.543189,False,sum,16,3,0.35000000000000003,0.15000000000000002,1000,600,0.0001627653315895705,3,8,FAIL
76,,,2024-12-17 21:16:51.601365,2024-12-17 21:26:23.850506,0 days 00:09:32.249141,False,sum,16,3,0.35000000000000003,0.2,1000,500,0.00016915470408077784,3,8,FAIL
77,,,2024-12-17 21:26:23.852705,2024-12-17 21:33:19.206410,0 days 00:06:55.353705,False,sum,16,3,0.0,0.15000000000000002,1000,500,0.00016088830971550127,3,8,FAIL
78,,,2024-12-17 21:33:19.210316,2024-12-17 21:43:45.858198,0 days 00:10:26.647882,False,sum,16,3,0.35000000000000003,0.15000000000000002,1000,600,0.00016500961678875015,3,8,FAIL
79,,,2024-12-17 21:43:45.860205,2024-12-17 21:54:16.244119,0 days 00:10:30.383914,False,sum,16,3,0.0,0.15000000000000002,1000,500,0.00018274943788546932,3,9,FAIL
80,,,2024-12-17 21:54:16.246258,2024-12-17 22:05:46.813292,0 days 00:11:30.567034,False,sum,16,3,0.35000000000000003,0.15000000000000002,1000,500,0.00016281904280391962,3,8,FAIL
81,,,2024-12-17 22:05:46.815686,2024-12-17 22:16:34.059827,0 days 00:10:47.244141,False,sum,16,3,0.0,0.2,1000,1200,0.00016878290951081407,3,8,FAIL
82,,,2024-12-17 22:16:34.080871,2024-12-17 22:24:06.446164,0 days 00:07:32.365293,False,sum,16,3,0.0,0.15000000000000002,1000,500,0.00015821909259431435,3,8,FAIL
83,,,2024-12-17 22:24:06.448665,2024-12-17 22:31:04.457597,0 days 00:06:58.008932,False,sum,16,3,0.35000000000000003,0.2,1000,600,0.00016744832717990722,3,9,FAIL
84,,,2024-12-17 22:31:04.459568,2024-12-17 22:38:51.391134,0 days 00:07:46.931566,False,sum,16,3,0.35000000000000003,0.15000000000000002,900,600,0.00016226069178310954,3,8,FAIL
85,,,2024-12-17 22:38:51.393585,2024-12-17 22:47:20.356334,0 days 00:08:28.962749,False,sum,16,3,0.35000000000000003,0.15000000000000002,1000,500,0.00016811378290839226,3,8,FAIL
86,,,2024-12-17 22:47:20.359498,2024-12-17 22:56:29.469554,0 days 00:09:09.110056,False,sum,16,3,0.35000000000000003,0.15000000000000002,1000,500,0.0001519773143747043,3,9,FAIL
87,,,2024-12-17 22:56:29.472505,2024-12-17 23:04:57.803114,0 days 00:08:28.330609,False,sum,16,3,0.35000000000000003,0.2,1000,500,0.00016006399091129285,3,8,FAIL
88,,,2024-12-17 23:04:57.838114,2024-12-17 23:15:10.605737,0 days 00:10:12.767623,False,sum,16,3,0.35000000000000003,0.2,1000,500,0.00017675106108173836,3,8,FAIL
89,,,2024-12-17 23:15:10.638718,2024-12-17 23:23:46.406962,0 days 00:08:35.768244,False,sum,16,3,0.35000000000000003,0.15000000000000002,1000,500,0.00016960716649914957,3,8,FAIL
90,,,2024-12-17 23:23:46.410084,2024-12-17 23:34:41.623203,0 days 00:10:55.213119,False,sum,16,3,0.35000000000000003,0.15000000000000002,1000,500,0.00016139360297964104,3,8,FAIL
91,,,2024-12-17 23:34:41.660372,2024-12-17 23:43:22.848258,0 days 00:08:41.187886,False,sum,16,3,0.35000000000000003,0.15000000000000002,1000,500,0.0001717271054635843,3,8,FAIL
92,,,2024-12-17 23:43:22.881468,2024-12-17 23:51:22.667814,0 days 00:07:59.786346,False,sum,16,3,0.35000000000000003,0.15000000000000002,1000,500,0.0001632559451634285,3,9,FAIL
93,,,2024-12-17 23:51:22.669693,2024-12-17 23:59:25.137119,0 days 00:08:02.467426,False,sum,16,3,0.0,0.2,900,1200,0.00018308350953522267,3,8,FAIL
94,,,2024-12-17 23:59:25.139984,2024-12-18 00:08:14.985678,0 days 00:08:49.845694,False,sum,16,3,0.35000000000000003,0.15000000000000002,1000,500,0.00017097440875371166,3,8,FAIL
95,,,2024-12-18 00:08:15.015526,2024-12-18 00:16:49.668011,0 days 00:08:34.652485,False,sum,16,3,0.35000000000000003,0.15000000000000002,1000,1200,0.00016361764429359904,3,3,FAIL
96,,,2024-12-18 00:16:49.678362,2024-12-18 00:25:03.348479,0 days 00:08:13.670117,False,sum,16,3,0.35000000000000003,0.15000000000000002,1000,1100,0.0001646745305663131,3,8,FAIL
97,,,2024-12-18 00:25:03.350707,2024-12-18 00:32:12.033314,0 days 00:07:08.682607,False,sum,16,3,0.35000000000000003,0.15000000000000002,1000,500,0.00016705654587243307,3,8,FAIL
98,,,2024-12-18 00:32:12.036069,2024-12-18 00:41:09.377338,0 days 00:08:57.341269,False,sum,16,3,0.35000000000000003,0.15000000000000002,900,1200,0.00016291298163113342,3,8,FAIL
99,,,2024-12-18 00:41:09.379244,2024-12-18 00:48:45.536619,0 days 00:07:36.157375,False,sum,16,2,0.35000000000000003,0.15000000000000002,1000,600,0.0001594677043583013,3,8,FAIL
