number,values_0,values_1,datetime_start,datetime_complete,duration,params_BN,params_aggregation,params_batch_size,params_depth,params_dropout_bond,params_dropout_ffn,params_hidden_bond,params_hidden_ffn,params_init_lr,params_layer,params_warmup_epochs,state
0,0.34280743229700866,0.5257379412651062,2024-12-18 00:48:45.681780,2024-12-18 01:00:09.469682,0 days 00:11:23.787902,True,sum,128,3,0.25,0.15000000000000002,600,2000,0.0002979662863278567,5,7,COMPLETE
1,0.2863544377048004,0.6311991214752197,2024-12-18 01:00:09.473690,2024-12-18 01:19:02.738500,0 days 00:18:53.264810,False,sum,128,2,0.1,0.30000000000000004,900,1400,0.0006678422239819404,1,3,COMPLETE
2,0.6185044508049559,0.4175031781196594,2024-12-18 01:19:02.750575,2024-12-18 01:26:12.506464,0 days 00:07:09.755889,False,norm,16,5,0.1,0.05,500,900,0.0001679291785826474,1,8,COMPLETE
3,0.453327603025761,0.44361966848373413,2024-12-18 01:26:12.514865,2024-12-18 01:34:07.982615,0 days 00:07:55.467750,False,norm,32,3,0.4,0.45,200,500,0.00011722221937535955,4,8,COMPLETE
4,0.19077009161578892,0.5605676770210266,2024-12-18 01:34:07.994687,2024-12-18 01:40:12.421827,0 days 00:06:04.427140,True,sum,16,1,0.05,0.35000000000000003,500,1900,0.0002723974501912266,1,10,COMPLETE
5,0.010625191465284435,0.6230459213256836,2024-12-18 01:40:12.434282,2024-12-18 01:47:02.985099,0 days 00:06:50.550817,True,sum,16,5,0.05,0.4,400,800,0.00011195958479090367,5,2,COMPLETE
6,0.3927055889495932,0.4876135289669037,2024-12-18 01:47:02.987051,2024-12-18 01:56:08.564230,0 days 00:09:05.577179,False,norm,32,1,0.2,0.25,500,1300,0.0002073181441757577,3,3,COMPLETE
7,0.5452703776160495,0.4121779203414917,2024-12-18 01:56:08.566243,2024-12-18 02:06:15.126712,0 days 00:10:06.560469,True,norm,128,4,0.35000000000000003,0.25,200,1400,0.0005618868655673099,1,3,COMPLETE
8,0.6593925147641764,0.3595931828022003,2024-12-18 02:06:15.132427,2024-12-18 02:12:40.876515,0 days 00:06:25.744088,True,sum,64,2,0.0,0.30000000000000004,500,500,0.0002839104720219943,1,3,COMPLETE
9,0.5724775950475828,0.4648239314556122,2024-12-18 02:12:40.888200,2024-12-18 02:21:12.390087,0 days 00:08:31.501887,True,sum,64,1,0.4,0.05,1000,1400,0.0004544860241787504,5,3,COMPLETE
10,0.6339316485825472,0.3506300449371338,2024-12-18 02:21:12.394694,2024-12-18 02:27:02.612790,0 days 00:05:50.218096,True,mean,64,2,0.5,0.15000000000000002,800,100,0.000998754223603081,3,5,COMPLETE
11,0.7380046168186202,0.29826751351356506,2024-12-18 02:27:02.618291,2024-12-18 02:34:33.001464,0 days 00:07:30.383173,True,mean,64,2,0.0,0.15000000000000002,800,300,0.00040981687477242005,3,5,COMPLETE
12,0.6875935990746281,0.35111966729164124,2024-12-18 02:34:33.011599,2024-12-18 02:42:08.120756,0 days 00:07:35.109157,True,mean,64,2,0.0,0.15000000000000002,700,100,0.0003929321906139916,2,5,COMPLETE
13,0.7736376524404287,0.316263347864151,2024-12-18 02:42:08.129594,2024-12-18 02:50:05.783229,0 days 00:07:57.653635,True,mean,64,4,0.0,0.15000000000000002,700,100,0.00040882820474516556,2,5,COMPLETE
14,0.7258553363767981,0.3285350799560547,2024-12-18 02:50:05.792844,2024-12-18 02:57:01.064244,0 days 00:06:55.271400,True,mean,64,4,0.15000000000000002,0.0,700,400,0.00039749939978357717,2,5,COMPLETE
15,0.7195139746803186,0.31991487741470337,2024-12-18 02:57:01.077531,2024-12-18 03:04:23.114065,0 days 00:07:22.036534,True,mean,64,3,0.0,0.2,1000,300,0.0005519314164486922,3,6,COMPLETE
16,0.4749184190081932,0.46823692321777344,2024-12-18 03:04:23.130258,2024-12-18 03:14:39.828863,0 days 00:10:16.698605,True,mean,64,4,0.30000000000000004,0.1,800,700,0.0003640334639566287,2,6,COMPLETE
17,0.3157714134246178,0.5661841034889221,2024-12-18 03:14:39.845731,2024-12-18 03:23:11.496922,0 days 00:08:31.651191,True,mean,64,3,0.15000000000000002,0.5,800,100,0.00022197992591181984,4,4,COMPLETE
18,,,2024-12-18 03:23:11.499203,2024-12-18 03:30:26.730098,0 days 00:07:15.230895,False,mean,32,4,0.1,0.2,700,1100,0.0003319360341406521,4,7,FAIL
19,0.3958188095538835,0.4572373628616333,2024-12-18 03:30:26.734047,2024-12-18 03:37:27.667270,0 days 00:07:00.933223,False,mean,32,4,0.1,0.2,300,1100,0.00047336210548461487,4,7,COMPLETE
20,0.6931303165281785,0.3335701823234558,2024-12-18 03:37:27.675840,2024-12-18 03:45:49.765246,0 days 00:08:22.089406,True,mean,64,5,0.2,0.0,700,300,0.00033537230314394296,2,10,COMPLETE
21,0.709041191291729,0.45583927631378174,2024-12-18 03:45:49.772817,2024-12-18 03:54:22.957019,0 days 00:08:33.184202,True,mean,64,2,0.05,0.1,900,700,0.0007021863671187878,3,4,COMPLETE
22,0.6401556880107968,0.36425384879112244,2024-12-18 03:54:22.963498,2024-12-18 04:00:57.566557,0 days 00:06:34.603059,True,mean,64,3,0.0,0.2,1000,300,0.0004969569383775268,3,6,COMPLETE
23,0.4555496883292003,0.45238712430000305,2024-12-18 04:00:57.574174,2024-12-18 04:08:17.939844,0 days 00:07:20.365670,True,mean,64,4,0.0,0.2,600,300,0.0003682839118458212,3,5,COMPLETE
24,0.5402631902228061,0.39885613322257996,2024-12-18 04:08:17.954161,2024-12-18 04:18:48.567486,0 days 00:10:30.613325,False,mean,64,2,0.05,0.1,900,500,0.0006156778280843808,2,7,COMPLETE
25,0.001927974431033928,0.6711630821228027,2024-12-18 04:18:48.572041,2024-12-18 04:26:48.303392,0 days 00:07:59.731351,True,mean,16,3,0.0,0.25,100,1700,0.00045504640100781687,4,4,COMPLETE
26,0.4350130798747904,0.5254326462745667,2024-12-18 04:26:48.314712,2024-12-18 04:34:05.044124,0 days 00:07:16.729412,True,mean,32,1,0.1,0.05,700,200,0.0003167490060501141,3,6,COMPLETE
27,0.7348257407945945,0.33144351840019226,2024-12-18 04:34:05.056770,2024-12-18 04:45:07.200739,0 days 00:11:02.143969,True,mean,128,3,0.5,0.15000000000000002,800,600,0.0005538485315480155,2,6,COMPLETE
28,0.6203580696964546,0.381224662065506,2024-12-18 04:45:07.214075,2024-12-18 04:54:59.189992,0 days 00:09:51.975917,False,norm,64,4,0.05,0.2,600,300,0.00025209993183359617,2,4,COMPLETE
29,0.3638219405560143,0.543999433517456,2024-12-18 04:54:59.194757,2024-12-18 05:04:52.154714,0 days 00:09:52.959957,True,mean,64,5,0.15000000000000002,0.1,900,1000,0.00033562641930813086,3,2,COMPLETE
30,0.5876634301149462,0.382257878780365,2024-12-18 05:04:52.166296,2024-12-18 05:14:09.813169,0 days 00:09:17.646873,True,mean,128,2,0.25,0.15000000000000002,600,200,0.0003011958470165901,4,8,COMPLETE
31,0.45159061829837177,0.49619758129119873,2024-12-18 05:14:09.826289,2024-12-18 05:20:47.084396,0 days 00:06:37.258107,True,norm,16,3,0.0,0.30000000000000004,400,400,0.00041430965014702163,3,9,COMPLETE
32,0.7067319633202601,0.3312757909297943,2024-12-18 05:20:47.086101,2024-12-18 05:32:13.851782,0 days 00:11:26.765681,True,mean,128,3,0.05,0.15000000000000002,800,600,0.0005431167513553084,2,6,COMPLETE
33,0.6175852201413796,0.3678942322731018,2024-12-18 05:32:13.855094,2024-12-18 05:39:56.231162,0 days 00:07:42.376068,True,mean,64,3,0.5,0.2,700,100,0.0004090526248434567,2,5,COMPLETE
34,0.010990158278733403,0.6102567315101624,2024-12-18 05:39:56.232761,2024-12-18 05:51:41.163496,0 days 00:11:44.930735,False,sum,128,4,0.1,0.05,800,200,0.0007326808576076079,2,7,COMPLETE
35,0.5905240861399639,0.3965294063091278,2024-12-18 05:51:41.172788,2024-12-18 06:00:38.939355,0 days 00:08:57.766567,False,mean,64,2,0.0,0.15000000000000002,1000,400,0.00015896866810020398,1,5,COMPLETE
36,0.5929795786542366,0.41164857149124146,2024-12-18 06:00:38.947507,2024-12-18 06:08:51.533556,0 days 00:08:12.586049,True,mean,32,5,0.05,0.1,600,600,0.00034686930639972913,5,6,COMPLETE
37,0.3750872999021448,0.4540931284427643,2024-12-18 06:08:51.543966,2024-12-18 06:15:11.153737,0 days 00:06:19.609771,True,sum,16,1,0.1,0.4,900,1700,0.00010020504141273134,1,4,COMPLETE
38,0.6307651990727596,0.42645004391670227,2024-12-18 06:15:11.161217,2024-12-18 06:25:47.805867,0 days 00:10:36.644650,False,norm,64,5,0.05,0.35000000000000003,400,2000,0.0003084277517703617,4,7,COMPLETE
39,0.7338523064713048,0.36499619483947754,2024-12-18 06:25:47.806980,2024-12-18 06:33:24.053188,0 days 00:07:36.246208,True,mean,128,4,0.0,0.15000000000000002,700,200,0.0005325753486831002,2,4,COMPLETE
40,0.48318871665552354,0.42107677459716797,2024-12-18 06:33:24.064451,2024-12-18 06:41:50.162971,0 days 00:08:26.098520,True,norm,32,1,0.45,0.30000000000000004,600,800,0.00026290909915645196,1,5,COMPLETE
41,0.13772758118099357,0.5784777402877808,2024-12-18 06:41:50.174313,2024-12-18 06:49:15.759379,0 days 00:07:25.585066,False,sum,16,3,0.1,0.05,800,600,0.00043220459683280437,3,8,COMPLETE
42,0.5758555773535166,0.39278629422187805,2024-12-18 06:49:15.760700,2024-12-18 06:56:50.293968,0 days 00:07:34.533268,True,mean,64,4,0.15000000000000002,0.0,700,400,0.0004036367742077553,2,5,COMPLETE
43,0.6525128268570095,0.5192453861236572,2024-12-18 06:56:50.306213,2024-12-18 07:05:14.209133,0 days 00:08:23.902920,True,mean,64,4,0.0,0.5,900,400,0.0003798545898191968,2,6,COMPLETE
44,0.5204634354069603,0.4863671362400055,2024-12-18 07:05:14.221606,2024-12-18 07:11:05.535775,0 days 00:05:51.314169,True,sum,64,4,0.05,0.35000000000000003,800,100,0.00013794642954106522,5,5,COMPLETE
45,0.4111370568710254,0.5437561273574829,2024-12-18 07:11:05.538015,2024-12-18 07:18:22.918844,0 days 00:07:17.380829,True,mean,64,1,0.35000000000000003,0.25,700,1200,0.0005077109358865748,1,9,COMPLETE
46,0.7188408145853536,0.3085936903953552,2024-12-18 07:18:22.926141,2024-12-18 07:26:00.769431,0 days 00:07:37.843290,True,norm,64,2,0.0,0.45,500,200,0.0004522089628532314,3,3,COMPLETE
47,0.5582066292930467,0.42316800355911255,2024-12-18 07:26:00.773370,2024-12-18 07:35:53.288538,0 days 00:09:52.515168,False,norm,128,2,0.05,0.45,500,200,0.0002890807942776727,2,2,COMPLETE
48,0.5985854313799244,0.3866710364818573,2024-12-18 07:35:53.292654,2024-12-18 07:41:50.556838,0 days 00:05:57.264184,True,sum,32,4,0.2,0.25,100,1600,0.00023397746180789242,1,3,COMPLETE
49,0.5905445325821507,0.42157667875289917,2024-12-18 07:41:50.559100,2024-12-18 07:48:13.412428,0 days 00:06:22.853328,True,mean,16,5,0.30000000000000004,0.4,300,100,0.0004402995273777841,2,3,COMPLETE
50,0.5407472759337985,0.4183354675769806,2024-12-18 07:48:13.418026,2024-12-18 07:58:36.900178,0 days 00:10:23.482152,False,norm,64,4,0.45,0.0,800,500,0.0006185493719918136,2,4,COMPLETE
51,0.023992418058201362,1.128544807434082,2024-12-18 07:58:36.908704,2024-12-18 08:10:08.796137,0 days 00:11:31.887433,True,mean,64,2,0.0,0.30000000000000004,500,1900,0.00019175816550950713,4,9,COMPLETE
52,0.7403820437126852,0.31866684556007385,2024-12-18 08:10:08.813850,2024-12-18 08:18:57.371667,0 days 00:08:48.557817,True,mean,64,2,0.0,0.1,400,200,0.00036997564429709255,3,5,COMPLETE
53,0.6458169060341977,0.3715705871582031,2024-12-18 08:18:57.376980,2024-12-18 08:25:13.591729,0 days 00:06:16.214749,True,mean,64,3,0.0,0.15000000000000002,1000,300,0.00036080798665265475,3,6,COMPLETE
54,0.7296705691288553,0.3118712902069092,2024-12-18 08:25:13.607124,2024-12-18 08:33:17.433671,0 days 00:08:03.826547,True,mean,64,2,0.0,0.2,800,100,0.0004809033632075121,3,10,COMPLETE
55,0.7514360673595614,0.2834871709346771,2024-12-18 08:33:17.453092,2024-12-18 08:44:36.160203,0 days 00:11:18.707111,True,mean,64,2,0.0,0.1,400,900,0.000494240175965766,4,5,COMPLETE
56,0.17066813591291735,0.6356227993965149,2024-12-18 08:44:36.177563,2024-12-18 08:55:50.324968,0 days 00:11:14.147405,False,sum,32,2,0.30000000000000004,0.05,300,900,0.0008500036661223396,5,10,COMPLETE
57,0.49596621812276975,0.4472373127937317,2024-12-18 08:55:50.328573,2024-12-18 09:06:40.330830,0 days 00:10:50.002257,True,norm,64,1,0.25,0.1,400,1400,0.0004919113609279069,4,5,COMPLETE
58,0.3980825428531593,0.45846426486968994,2024-12-18 09:06:40.354184,2024-12-18 09:16:16.098543,0 days 00:09:35.744359,True,mean,64,2,0.4,0.1,200,1100,0.0005999959880089699,5,4,COMPLETE
59,,,2024-12-18 09:16:16.102638,2024-12-18 09:26:45.834806,0 days 00:10:29.732168,False,mean,16,2,0.35000000000000003,0.05,300,1500,0.0004555286882614592,4,5,FAIL
60,0.18999512355553677,0.551076352596283,2024-12-18 09:26:45.838829,2024-12-18 09:41:30.601278,0 days 00:14:44.762449,False,mean,16,2,0.35000000000000003,0.05,300,1500,0.0004593943789545486,4,5,COMPLETE
61,0.4064251884770278,0.45517367124557495,2024-12-18 09:41:30.609376,2024-12-18 09:50:04.701120,0 days 00:08:34.091744,True,sum,64,1,0.2,0.1,400,1300,0.0004767942129249053,4,7,COMPLETE
62,0.3053215340295271,0.5636346936225891,2024-12-18 09:50:04.707724,2024-12-18 10:00:47.486400,0 days 00:10:42.778676,True,mean,64,2,0.2,0.45,200,900,0.0006676808079259971,5,4,COMPLETE
63,0.6428118991099919,0.3624802231788635,2024-12-18 10:00:47.487929,2024-12-18 10:10:46.894477,0 days 00:09:59.406548,True,mean,64,3,0.0,0.15000000000000002,400,800,0.00039124656997390584,4,6,COMPLETE
64,0.6105846740198579,0.43556272983551025,2024-12-18 10:10:46.915498,2024-12-18 10:23:05.026822,0 days 00:12:18.111324,True,mean,128,3,0.05,0.1,500,1000,0.0005744867023036228,5,5,COMPLETE
65,0.5893122980076498,0.37009602785110474,2024-12-18 10:23:05.028897,2024-12-18 10:34:34.881638,0 days 00:11:29.852741,True,mean,64,1,0.0,0.15000000000000002,400,1200,0.0005000488970184826,4,5,COMPLETE
66,0.2615998993734072,0.5183805823326111,2024-12-18 10:34:34.903595,2024-12-18 10:43:55.474678,0 days 00:09:20.571083,True,mean,64,3,0.05,0.2,300,900,0.00027397296816130523,3,6,COMPLETE
67,0.5740118567532768,0.44413962960243225,2024-12-18 10:43:55.496936,2024-12-18 10:53:04.099459,0 days 00:09:08.602523,True,mean,32,5,0.0,0.1,500,700,0.00043210314984730246,3,5,COMPLETE
68,0.7050853581470112,0.3951988220214844,2024-12-18 10:53:04.121997,2024-12-18 11:03:30.014950,0 days 00:10:25.892953,True,norm,64,2,0.0,0.05,400,1000,0.0003429228483026484,3,8,COMPLETE
69,0.44603816292601,0.4450574517250061,2024-12-18 11:03:30.039032,2024-12-18 11:19:28.524202,0 days 00:15:58.485170,False,mean,128,3,0.1,0.15000000000000002,500,1200,0.0005443991101980676,4,4,COMPLETE
70,,,2024-12-18 11:19:28.549959,2024-12-18 11:30:02.191787,0 days 00:10:33.641828,True,mean,16,1,0.05,0.2,300,1900,0.0003739941292250783,5,5,FAIL
71,,,2024-12-18 11:30:02.194290,2024-12-18 11:39:55.035344,0 days 00:09:52.841054,True,mean,16,1,0.05,0.2,300,1900,0.00019868343701272127,5,5,FAIL
72,,,2024-12-18 11:39:55.038062,2024-12-18 11:51:15.027380,0 days 00:11:19.989318,True,mean,16,1,0.05,0.2,300,1900,0.00032414309159479576,5,5,FAIL
73,0.5088488302216394,0.42571356892585754,2024-12-18 11:51:15.033447,2024-12-18 12:02:56.985005,0 days 00:11:41.951558,True,mean,64,1,0.05,0.2,300,800,0.00018987575137730496,5,5,COMPLETE
74,0.1854842651049224,0.5787855386734009,2024-12-18 12:02:56.997112,2024-12-18 12:12:31.431773,0 days 00:09:34.434661,True,mean,16,2,0.0,0.15000000000000002,500,1100,0.000324109191215386,4,6,COMPLETE
75,,,2024-12-18 12:12:31.437238,2024-12-18 12:27:32.233399,0 days 00:15:00.796161,False,sum,64,5,0.05,0.1,600,1900,0.00037286320815414423,4,3,FAIL
76,,,2024-12-18 12:27:32.241376,2024-12-18 12:41:00.960181,0 days 00:13:28.718805,False,sum,64,5,0.05,0.1,600,1900,0.00012599410520380862,4,4,FAIL
77,,,2024-12-18 12:41:00.972854,2024-12-18 12:58:45.446699,0 days 00:17:44.473845,False,sum,64,5,0.05,0.1,600,1900,0.00037045299507996446,4,3,FAIL
78,0.13847008919912884,0.5812840461730957,2024-12-18 12:58:45.458597,2024-12-18 13:07:52.992493,0 days 00:09:07.533896,False,sum,64,5,0.05,0.1,600,1900,0.00011882215840141008,4,3,COMPLETE
79,0.40202668511544254,0.6069587469100952,2024-12-18 13:07:52.996370,2024-12-18 13:18:05.193916,0 days 00:10:12.197546,True,mean,64,3,0.15000000000000002,0.1,400,700,0.00037379508210002806,2,4,COMPLETE
80,0.5240399482880754,0.43906301259994507,2024-12-18 13:18:05.216077,2024-12-18 13:32:22.415179,0 days 00:14:17.199102,True,mean,64,3,0.25,0.05,300,1300,0.0005183114910418918,3,6,COMPLETE
81,0.4143694197177536,0.547444760799408,2024-12-18 13:32:22.438368,2024-12-18 13:40:39.472392,0 days 00:08:17.034024,True,mean,32,4,0.30000000000000004,0.2,400,1500,0.0004576683272712874,2,5,COMPLETE
82,0.6400416952975551,0.34759899973869324,2024-12-18 13:40:39.492548,2024-12-18 13:50:08.557786,0 days 00:09:29.065238,True,norm,64,5,0.5,0.15000000000000002,600,100,0.000296119197102459,5,5,COMPLETE
83,0.4395578562047602,0.4518781304359436,2024-12-18 13:50:08.563411,2024-12-18 14:00:49.184662,0 days 00:10:40.621251,True,mean,128,2,0.45,0.1,400,1000,0.0004221537519342648,3,4,COMPLETE
84,0.4519344492023825,0.420869380235672,2024-12-18 14:00:49.187536,2024-12-18 14:12:09.148787,0 days 00:11:19.961251,False,mean,16,2,0.1,0.05,200,600,0.0004754311449335316,2,10,COMPLETE
85,0.5187286915985945,0.401455819606781,2024-12-18 14:12:09.155347,2024-12-18 14:21:27.457749,0 days 00:09:18.302402,True,sum,64,4,0.15000000000000002,0.0,500,800,0.0005698426122076399,3,5,COMPLETE
86,0.46697849790290225,0.4421341121196747,2024-12-18 14:21:27.467445,2024-12-18 14:31:52.048584,0 days 00:10:24.581139,True,mean,64,1,0.1,0.15000000000000002,100,300,0.00031950784494125115,1,7,COMPLETE
87,0.49306308891267686,0.412149041891098,2024-12-18 14:31:52.051563,2024-12-18 14:40:21.575182,0 days 00:08:29.523619,False,norm,64,3,0.35000000000000003,0.5,700,200,0.00041540600563507634,2,6,COMPLETE
88,0.5105495792689552,0.5178914666175842,2024-12-18 14:40:21.580159,2024-12-18 14:51:17.364528,0 days 00:10:55.784369,True,mean,32,2,0.4,0.35000000000000003,600,500,0.00035538296674082076,5,2,COMPLETE
89,0.7149819452677969,0.41123345494270325,2024-12-18 14:51:17.386970,2024-12-18 14:58:47.001056,0 days 00:07:29.614086,True,mean,64,4,0.0,0.15000000000000002,700,100,0.0005267600035783638,2,4,COMPLETE
90,0.5958445019448702,0.3707214295864105,2024-12-18 14:58:47.014207,2024-12-18 15:08:34.542393,0 days 00:09:47.528186,True,mean,64,4,0.25,0.2,800,200,0.0003853819387413951,2,5,COMPLETE
91,0.6950514703479506,0.3678121268749237,2024-12-18 15:08:34.550273,2024-12-18 15:20:24.418581,0 days 00:11:49.868308,True,mean,128,4,0.0,0.15000000000000002,700,100,0.00044242192784262155,2,6,COMPLETE
92,0.5922352253669311,0.3834497332572937,2024-12-18 15:20:24.424162,2024-12-18 15:28:58.599524,0 days 00:08:34.175362,True,mean,64,4,0.05,0.1,900,200,0.0003993819935557577,2,5,COMPLETE
93,0.5585080075472483,0.3941032588481903,2024-12-18 15:28:58.618095,2024-12-18 15:38:49.399180,0 days 00:09:50.781085,True,mean,64,4,0.30000000000000004,0.25,600,300,0.00024254762540450763,2,4,COMPLETE
94,0.585666357172488,0.38844165205955505,2024-12-18 15:38:49.416871,2024-12-18 15:49:49.597833,0 days 00:11:00.180962,True,mean,64,4,0.0,0.15000000000000002,700,1800,0.00048649679370022994,1,5,COMPLETE
95,0.6637958807138608,0.3670385777950287,2024-12-18 15:49:49.599572,2024-12-18 15:59:41.014905,0 days 00:09:51.415333,True,sum,16,4,0.15000000000000002,0.1,800,200,0.0009422989705471068,2,6,COMPLETE
96,0.6301596209073744,0.3577759265899658,2024-12-18 15:59:41.031178,2024-12-18 16:08:31.030730,0 days 00:08:49.999552,True,mean,64,4,0.2,0.15000000000000002,500,100,0.0005346111787602635,2,4,COMPLETE
97,0.5993889119085263,0.3681713938713074,2024-12-18 16:08:31.033731,2024-12-18 16:19:44.858246,0 days 00:11:13.824515,False,norm,64,4,0.05,0.2,1000,900,0.00027846019406559954,1,5,COMPLETE
98,0.6460965397271163,0.41685399413108826,2024-12-18 16:19:44.859929,2024-12-18 16:31:18.678035,0 days 00:11:33.818106,True,mean,128,4,0.0,0.45,400,200,0.00035811174599595553,4,9,COMPLETE
99,0.7705917051474711,0.34384721517562866,2024-12-18 16:31:18.683287,2024-12-18 16:41:56.012729,0 days 00:10:37.329442,True,mean,64,4,0.0,0.1,700,400,0.0004516078937655667,2,3,COMPLETE
