number,values_0,values_1,datetime_start,datetime_complete,duration,params_BN,params_aggregation,params_batch_size,params_depth,params_dropout_bond,params_dropout_ffn,params_hidden_bond,params_hidden_ffn,params_init_lr,params_layer,params_warmup_epochs,state
0,0.6029079123495028,0.4077610671520233,2024-12-19 08:09:38.701065,2024-12-19 08:16:46.687593,0 days 00:07:07.986528,True,sum,64,1,0.4,0.2,1000,100,0.0006904985535600129,5,9,COMPLETE
1,0.6099827488952269,0.38606899976730347,2024-12-19 08:16:46.689596,2024-12-19 08:27:46.680218,0 days 00:10:59.990622,False,mean,64,3,0.4,0.15000000000000002,1000,1500,0.00011814794175703487,2,5,COMPLETE
2,0.4655703644117679,0.5579965114593506,2024-12-19 08:27:46.683536,2024-12-19 08:35:32.421407,0 days 00:07:45.737871,True,sum,16,4,0.5,0.5,500,900,0.0005527668332121003,2,6,COMPLETE
3,0.623088978457635,0.4054325819015503,2024-12-19 08:35:32.461105,2024-12-19 08:45:59.786510,0 days 00:10:27.325405,False,norm,128,3,0.25,0.30000000000000004,800,500,0.00041955516216722285,4,7,COMPLETE
4,0.6516082999770861,0.35198619961738586,2024-12-19 08:45:59.817554,2024-12-19 08:51:55.100686,0 days 00:05:55.283132,True,norm,64,1,0.1,0.0,600,200,0.0004985799626480548,3,10,COMPLETE
5,0.2388004539302774,0.5520617961883545,2024-12-19 08:51:55.148653,2024-12-19 09:06:39.027719,0 days 00:14:43.879066,True,mean,16,3,0.5,0.4,700,200,0.0001111911778452185,5,10,COMPLETE
6,0.240674243673578,0.5585388541221619,2024-12-19 09:06:39.030232,2024-12-19 09:14:09.381432,0 days 00:07:30.351200,False,mean,64,2,0.25,0.35000000000000003,300,200,0.000511776918244172,5,7,COMPLETE
7,0.3303860233358793,0.57016521692276,2024-12-19 09:14:09.389425,2024-12-19 09:21:13.932554,0 days 00:07:04.543129,True,mean,32,3,0.5,0.35000000000000003,500,200,0.0003437029716895556,4,9,COMPLETE
8,0.024566996524184086,2.55470871925354,2024-12-19 09:21:13.934638,2024-12-19 09:35:34.679887,0 days 00:14:20.745249,False,sum,64,3,0.4,0.15000000000000002,300,1900,0.00015011001703076125,3,2,COMPLETE
9,0.06987636934958817,0.6216041445732117,2024-12-19 09:35:34.734688,2024-12-19 09:47:30.589573,0 days 00:11:55.854885,True,mean,64,1,0.2,0.30000000000000004,700,700,0.0002830936012476895,5,8,COMPLETE
10,0.47310302469035953,0.44869112968444824,2024-12-19 09:47:30.593088,2024-12-19 09:56:27.797076,0 days 00:08:57.203988,True,norm,128,1,0.0,0.0,100,1300,0.0009862573958457485,1,4,COMPLETE
11,0.11574106701918463,0.6355302929878235,2024-12-19 09:56:27.848288,2024-12-19 10:07:49.788506,0 days 00:11:21.940218,True,norm,32,5,0.05,0.0,1000,1400,0.0002628319800911705,3,4,COMPLETE
12,0.6121840174654276,0.46565020084381104,2024-12-19 10:07:49.836777,2024-12-19 10:19:06.523552,0 days 00:11:16.686775,False,norm,64,2,0.1,0.1,300,2000,0.0007686774645797478,2,10,COMPLETE
13,0.45793850225355753,0.4491674602031708,2024-12-19 10:19:06.525040,2024-12-19 10:29:04.685182,0 days 00:09:58.160142,True,norm,64,2,0.15000000000000002,0.1,800,1200,0.00022192510431794007,3,5,COMPLETE
14,0.44430611265273473,0.8356654047966003,2024-12-19 10:29:04.689371,2024-12-19 10:37:15.857803,0 days 00:08:11.168432,True,norm,16,5,0.0,0.05,600,1600,0.00039458051439128977,2,3,COMPLETE
15,0.5156529433490911,0.438813179731369,2024-12-19 10:37:15.907729,2024-12-19 10:47:31.522730,0 days 00:10:15.615001,False,norm,128,4,0.1,0.2,100,500,0.000535064691708713,1,8,COMPLETE
16,0.3376404069652137,0.5061599016189575,2024-12-19 10:47:31.569410,2024-12-19 10:54:21.418945,0 days 00:06:49.849535,True,norm,32,2,0.30000000000000004,0.0,400,1000,0.00022330188052147637,4,6,COMPLETE
17,0.6246136488307444,0.38152849674224854,2024-12-19 10:54:21.423054,2024-12-19 11:00:08.337499,0 days 00:05:46.914445,True,sum,64,1,0.15000000000000002,0.1,900,500,0.00041282641243329426,2,10,COMPLETE
18,0.4495458527383194,0.4626941680908203,2024-12-19 11:00:08.341624,2024-12-19 11:06:49.568523,0 days 00:06:41.226899,True,sum,64,1,0.15000000000000002,0.05,800,500,0.0004119148524673801,4,9,COMPLETE
19,0.51385996550561,0.4763084352016449,2024-12-19 11:06:49.621823,2024-12-19 11:15:57.143068,0 days 00:09:07.521245,True,norm,16,1,0.1,0.5,600,700,0.0006573521209912637,3,10,COMPLETE
20,0.4958729030489027,0.5085350871086121,2024-12-19 11:15:57.194479,2024-12-19 11:23:54.481514,0 days 00:07:57.287035,True,norm,128,2,0.30000000000000004,0.05,400,400,0.0003192744083561411,1,8,COMPLETE
21,0.5452583972127764,0.41377976536750793,2024-12-19 11:23:54.532888,2024-12-19 11:35:47.331559,0 days 00:11:52.798671,False,norm,64,1,0.05,0.1,900,300,0.0009340736344366006,2,5,COMPLETE
22,0.2596595057960466,0.5589811205863953,2024-12-19 11:35:47.385164,2024-12-19 11:42:26.161809,0 days 00:06:38.776645,True,sum,64,1,0.15000000000000002,0.0,200,700,0.00045042826336013297,3,2,COMPLETE
23,0.3279914754439855,0.5498440861701965,2024-12-19 11:42:26.165467,2024-12-19 11:51:42.872467,0 days 00:09:16.707000,False,mean,32,4,0.05,0.05,700,100,0.0006009933483998585,3,7,COMPLETE
24,0.6929794974022307,0.34234073758125305,2024-12-19 11:51:42.874403,2024-12-19 12:01:05.161178,0 days 00:09:22.286775,True,norm,64,2,0.2,0.15000000000000002,400,400,0.0007880070113807897,2,5,COMPLETE
25,0.5007232883927265,0.4417630732059479,2024-12-19 12:01:05.164379,2024-12-19 12:08:29.529302,0 days 00:07:24.364923,True,norm,64,2,0.2,0.2,400,800,0.0008058525066445392,1,4,COMPLETE
26,0.5576187923235305,0.4288635849952698,2024-12-19 12:08:29.577586,2024-12-19 12:19:21.725992,0 days 00:10:52.148406,True,norm,64,2,0.30000000000000004,0.25,200,1700,0.000850170498418617,2,3,COMPLETE
27,0.6173883147996173,0.3978002369403839,2024-12-19 12:19:21.730316,2024-12-19 12:27:33.630468,0 days 00:08:11.900152,True,sum,128,4,0.35000000000000003,0.15000000000000002,500,1100,0.0007101069414927549,2,6,COMPLETE
28,0.49396514439577194,0.4759690463542938,2024-12-19 12:27:33.633823,2024-12-19 12:35:16.698845,0 days 00:07:43.065022,True,norm,32,2,0.25,0.25,200,400,0.0008603282121158646,1,3,COMPLETE
29,0.6137902352637884,0.4530335068702698,2024-12-19 12:35:16.740401,2024-12-19 12:46:38.695092,0 days 00:11:21.954691,True,sum,16,3,0.2,0.2,400,600,0.0006875240840088245,2,5,COMPLETE
30,0.6562528651180964,0.37521690130233765,2024-12-19 12:46:38.747970,2024-12-19 12:56:35.267223,0 days 00:09:56.519253,False,norm,64,5,0.4,0.4,600,100,0.0006235210993132465,1,6,COMPLETE
31,0.4384894397852466,0.47651049494743347,2024-12-19 12:56:35.271808,2024-12-19 13:07:23.379195,0 days 00:10:48.107387,True,norm,64,5,0.2,0.45,300,300,0.0006071289784465439,1,6,COMPLETE
32,0.6309370060833506,0.38912340998649597,2024-12-19 13:07:23.387214,2024-12-19 13:18:43.533193,0 days 00:11:20.145979,False,mean,64,3,0.35000000000000003,0.15000000000000002,500,100,0.0007474933686342853,2,5,COMPLETE
33,0.46341800574390696,0.4537992775440216,2024-12-19 13:18:43.536744,2024-12-19 13:29:42.835617,0 days 00:10:59.298873,True,norm,64,2,0.45,0.25,600,900,0.0008784387341205041,3,4,COMPLETE
34,,,2024-12-19 13:29:42.845874,2024-12-19 13:42:39.049052,0 days 00:12:56.203178,False,sum,16,4,0.25,0.15000000000000002,400,400,0.0009985169423146084,2,7,FAIL
35,,,2024-12-19 13:42:39.053022,2024-12-19 13:53:14.612052,0 days 00:10:35.559030,False,sum,16,4,0.25,0.15000000000000002,400,400,0.0004971156444023609,2,7,FAIL
36,,,2024-12-19 13:53:14.617824,2024-12-19 14:03:23.586585,0 days 00:10:08.968761,False,sum,16,4,0.25,0.15000000000000002,400,400,0.0009924440962277201,2,7,FAIL
37,,,2024-12-19 14:03:23.652928,2024-12-19 14:15:01.829989,0 days 00:11:38.177061,False,sum,16,4,0.25,0.15000000000000002,400,400,0.0009537892626349074,2,7,FAIL
38,,,2024-12-19 14:15:01.832919,2024-12-19 14:26:14.887756,0 days 00:11:13.054837,False,sum,16,4,0.25,0.15000000000000002,400,400,0.0004969829664335682,2,7,FAIL
39,,,2024-12-19 14:26:14.892003,2024-12-19 14:35:46.250762,0 days 00:09:31.358759,False,sum,16,4,0.25,0.15000000000000002,400,400,0.0009653717591892262,2,7,FAIL
40,0.4709537154534689,0.46217578649520874,2024-12-19 14:35:46.256211,2024-12-19 14:46:41.923599,0 days 00:10:55.667388,False,sum,16,4,0.25,0.15000000000000002,400,400,0.00048253792568209196,2,7,COMPLETE
41,0.2500971033401838,0.5573649406433105,2024-12-19 14:46:41.980427,2024-12-19 14:56:17.727538,0 days 00:09:35.747111,True,norm,64,3,0.15000000000000002,0.30000000000000004,300,600,0.0006017289430857733,4,5,COMPLETE
42,0.5658250622171372,0.40863481163978577,2024-12-19 14:56:17.787341,2024-12-19 15:09:52.774147,0 days 00:13:34.986806,False,mean,128,2,0.35000000000000003,0.2,900,300,0.0009868479619124257,1,4,COMPLETE
43,,,2024-12-19 15:09:52.824547,2024-12-19 15:19:34.848923,0 days 00:09:42.024376,True,norm,64,1,0.2,0.4,500,1800,0.00010043605026396373,5,6,FAIL
44,0.30078068814778414,0.5600265860557556,2024-12-19 15:19:34.852710,2024-12-19 15:29:15.604904,0 days 00:09:40.752194,True,norm,64,1,0.2,0.35000000000000003,500,900,0.0007382938987821065,5,6,COMPLETE
45,0.46261752003541773,0.5172262787818909,2024-12-19 15:29:15.670031,2024-12-19 15:40:19.081179,0 days 00:11:03.411148,True,mean,32,3,0.45,0.1,200,600,0.00013941644331206602,2,5,COMPLETE
46,,,2024-12-19 15:40:19.143527,2024-12-19 15:49:18.760736,0 days 00:08:59.617209,False,sum,16,4,0.25,0.30000000000000004,400,1800,0.00010332066084083624,3,6,FAIL
47,,,2024-12-19 15:49:18.763147,2024-12-19 15:58:04.892489,0 days 00:08:46.129342,False,sum,16,4,0.25,0.4,400,200,0.00010302033114336333,3,6,FAIL
48,,,2024-12-19 15:58:04.897595,2024-12-19 16:10:47.209580,0 days 00:12:42.311985,False,sum,16,4,0.25,0.4,400,1800,0.0005361758833179539,3,6,FAIL
49,,,2024-12-19 16:10:47.230879,2024-12-19 16:21:32.591202,0 days 00:10:45.360323,False,sum,16,4,0.25,0.4,400,1700,0.000532546690977307,3,6,FAIL
50,0.0008996731987561812,0.6576130390167236,2024-12-19 16:21:32.606449,2024-12-19 16:29:06.066087,0 days 00:07:33.459638,False,sum,16,4,0.25,0.4,400,200,0.0004987046654777769,3,6,COMPLETE
51,0.007432131948036179,0.6439062356948853,2024-12-19 16:29:06.127764,2024-12-19 16:37:33.789022,0 days 00:08:27.661258,True,mean,64,2,0.30000000000000004,0.45,500,1800,0.0005592941984519326,4,7,COMPLETE
52,0.6839366962706026,0.35817399621009827,2024-12-19 16:37:33.792278,2024-12-19 16:48:05.949111,0 days 00:10:32.156833,False,norm,64,3,0.35000000000000003,0.15000000000000002,500,100,0.000749157823054928,2,5,COMPLETE
53,0.4794940573937709,0.45056796073913574,2024-12-19 16:48:05.952207,2024-12-19 16:56:07.662635,0 days 00:08:01.710428,True,norm,64,1,0.2,0.15000000000000002,300,500,0.0001011922733459801,2,4,COMPLETE
54,0.5772408381067268,0.44856134057044983,2024-12-19 16:56:07.691162,2024-12-19 17:10:36.528719,0 days 00:14:28.837557,False,norm,128,3,0.45,0.2,600,1400,0.0006493005320453189,2,5,COMPLETE
55,0.36474517430353876,0.5102319717407227,2024-12-19 17:10:36.531206,2024-12-19 17:19:41.341317,0 days 00:09:04.810111,True,norm,64,5,0.1,0.1,900,200,0.0007964343380061729,5,3,COMPLETE
56,0.5512862156475811,0.4869716167449951,2024-12-19 17:19:41.418238,2024-12-19 17:29:18.600302,0 days 00:09:37.182064,True,sum,32,2,0.15000000000000002,0.25,1000,800,0.0009137399038528958,2,6,COMPLETE
57,0.32014715076212186,0.5244709253311157,2024-12-19 17:29:18.604860,2024-12-19 17:46:29.547714,0 days 00:17:10.942854,False,mean,64,3,0.4,0.15000000000000002,400,2000,0.00037489906693337875,3,9,COMPLETE
58,0.5129900162777584,0.4201482832431793,2024-12-19 17:46:29.559865,2024-12-19 17:57:41.544806,0 days 00:11:11.984941,True,norm,16,1,0.2,0.2,700,400,0.00012514227556316548,1,2,COMPLETE
59,0.46694123620482963,0.44844987988471985,2024-12-19 17:57:41.593570,2024-12-19 18:09:56.343206,0 days 00:12:14.749636,True,norm,64,2,0.25,0.30000000000000004,100,1500,0.00017178766620255453,2,8,COMPLETE
60,0.5797170954113332,0.44855841994285583,2024-12-19 18:09:56.410890,2024-12-19 18:20:18.278018,0 days 00:10:21.867128,False,norm,128,3,0.15000000000000002,0.1,300,300,0.0003508499330110024,2,4,COMPLETE
61,,,2024-12-19 18:20:18.281500,2024-12-19 18:30:55.994895,0 days 00:10:37.713395,True,mean,32,1,0.1,0.5,500,1100,0.00045251250638653553,5,3,FAIL
62,,,2024-12-19 18:30:56.051634,2024-12-19 18:39:55.632425,0 days 00:08:59.580791,True,mean,32,1,0.5,0.5,500,1100,0.0007899164027345111,5,7,FAIL
63,,,2024-12-19 18:39:55.692221,2024-12-19 18:48:14.610519,0 days 00:08:18.918298,True,mean,32,1,0.1,0.5,500,1200,0.0004586190934047929,5,3,FAIL
64,,,2024-12-19 18:48:14.673485,2024-12-19 18:58:09.321063,0 days 00:09:54.647578,True,mean,32,1,0.5,0.15000000000000002,500,1100,0.0002805152937639247,5,7,FAIL
65,0.43925028404054045,0.4846371114253998,2024-12-19 18:58:09.325914,2024-12-19 19:09:45.134883,0 days 00:11:35.808969,True,mean,32,1,0.5,0.5,500,100,0.0009859944312031947,5,7,COMPLETE
66,0.652973942207718,0.3792468309402466,2024-12-19 19:09:45.143665,2024-12-19 19:19:57.584561,0 days 00:10:12.440896,False,norm,64,3,0.35000000000000003,0.15000000000000002,500,100,0.0007526104422922521,2,5,COMPLETE
67,0.657028364995392,0.35246947407722473,2024-12-19 19:19:57.602493,2024-12-19 19:29:27.714247,0 days 00:09:30.111754,True,norm,64,4,0.2,0.15000000000000002,400,500,0.00029664606937578476,2,5,COMPLETE
68,0.5710272965364885,0.4700884521007538,2024-12-19 19:29:27.766522,2024-12-19 19:38:37.603345,0 days 00:09:09.836823,True,norm,64,4,0.0,0.4,400,600,0.0007877432997111079,1,5,COMPLETE
69,,,2024-12-19 19:38:37.605967,2024-12-19 19:45:57.009292,0 days 00:07:19.403325,True,norm,16,5,0.05,0.30000000000000004,500,1100,0.0004421162865330361,4,5,FAIL
70,0.24365401966645667,0.5806856155395508,2024-12-19 19:45:57.013328,2024-12-19 19:56:47.285762,0 days 00:10:50.272434,True,norm,16,5,0.05,0.35000000000000003,500,1100,0.0003011172994257779,3,5,COMPLETE
71,0.6072229088538362,0.4031849801540375,2024-12-19 19:56:47.332302,2024-12-19 20:06:34.288997,0 days 00:09:46.956695,False,norm,64,2,0.30000000000000004,0.30000000000000004,700,400,0.00045574233965197574,4,6,COMPLETE
72,0.2158824500827088,0.5622464418411255,2024-12-19 20:06:34.349527,2024-12-19 20:14:43.275409,0 days 00:08:08.925882,True,sum,128,2,0.1,0.0,300,1300,0.000247572736585122,4,9,COMPLETE
73,0.49467605715486257,0.4460667073726654,2024-12-19 20:14:43.341678,2024-12-19 20:23:43.875462,0 days 00:09:00.533784,True,norm,64,3,0.4,0.05,400,1800,0.00017123280701325972,1,3,COMPLETE
74,0.3344331798564179,0.5631983280181885,2024-12-19 20:23:43.880187,2024-12-19 20:33:47.454767,0 days 00:10:03.574580,False,mean,32,1,0.35000000000000003,0.45,800,500,0.0005359054904112987,3,4,COMPLETE
75,0.4394549966085924,0.5139702558517456,2024-12-19 20:33:47.505046,2024-12-19 20:44:04.578910,0 days 00:10:17.073864,True,norm,64,4,0.0,0.30000000000000004,600,700,0.0006911581011805015,3,6,COMPLETE
76,0.5333132177376286,0.4388710856437683,2024-12-19 20:44:04.628665,2024-12-19 20:52:17.527797,0 days 00:08:12.899132,True,norm,16,2,0.1,0.4,200,200,0.0008293283366588098,1,2,COMPLETE
77,0.5180418527656173,0.4486714005470276,2024-12-19 20:52:17.530109,2024-12-19 21:01:43.466482,0 days 00:09:25.936373,True,sum,64,1,0.2,0.15000000000000002,400,500,0.00038549745720837695,2,10,COMPLETE
78,0.6890915746041837,0.3557543456554413,2024-12-19 21:01:43.471387,2024-12-19 21:12:51.437072,0 days 00:11:07.965685,True,norm,64,2,0.15000000000000002,0.1,300,300,0.0007606458530699877,2,5,COMPLETE
79,0.33285477745203296,0.5222768783569336,2024-12-19 21:12:51.440695,2024-12-19 21:25:57.381732,0 days 00:13:05.941037,True,norm,64,3,0.25,0.15000000000000002,500,300,0.0007579734771287299,4,5,COMPLETE
80,0.5717313952393657,0.4063664376735687,2024-12-19 21:25:57.444221,2024-12-19 21:36:30.595218,0 days 00:10:33.150997,False,norm,128,5,0.2,0.2,300,1600,0.0006529366511836192,3,4,COMPLETE
81,0.46087208376358674,0.4716812074184418,2024-12-19 21:36:30.602892,2024-12-19 21:46:19.980855,0 days 00:09:49.377963,True,mean,64,2,0.15000000000000002,0.1,100,800,0.0009141586160923039,1,5,COMPLETE
82,0.38276788475904844,0.5427685379981995,2024-12-19 21:46:19.983548,2024-12-19 21:56:27.612018,0 days 00:10:07.628470,True,norm,32,4,0.25,0.2,400,400,0.00027976672611456645,5,4,COMPLETE
83,0.5082605448207701,0.43571537733078003,2024-12-19 21:56:27.616735,2024-12-19 22:10:58.611631,0 days 00:14:30.994896,False,sum,64,1,0.2,0.15000000000000002,300,1900,0.0004352094846786495,2,5,COMPLETE
84,0.6837469308971361,0.35434454679489136,2024-12-19 22:10:58.687168,2024-12-19 22:25:30.066252,0 days 00:14:31.379084,True,norm,64,2,0.15000000000000002,0.1,800,1200,0.0008437505435368416,1,8,COMPLETE
85,0.5460800406048769,0.4329192042350769,2024-12-19 22:25:30.128473,2024-12-19 22:34:46.447188,0 days 00:09:16.318715,True,norm,16,2,0.15000000000000002,0.1,1000,1200,0.00021050831624568636,2,7,COMPLETE
86,0.5209013982298452,0.43215370178222656,2024-12-19 22:34:46.448897,2024-12-19 22:42:26.930832,0 days 00:07:40.481935,True,mean,128,2,0.25,0.2,400,300,0.0005730519351769109,2,6,COMPLETE
87,0.6807612397859615,0.3487528860569,2024-12-19 22:42:26.933074,2024-12-19 22:52:08.233702,0 days 00:09:41.300628,True,norm,64,3,0.2,0.15000000000000002,400,600,0.0008479006378153747,2,5,COMPLETE
88,0.7188409053554707,0.33878669142723083,2024-12-19 22:52:08.249618,2024-12-19 23:01:31.625477,0 days 00:09:23.375859,True,norm,64,3,0.2,0.1,800,400,0.0008406031135734323,2,5,COMPLETE
89,0.2276001642794051,0.562667727470398,2024-12-19 23:01:31.627409,2024-12-19 23:10:06.309146,0 days 00:08:34.681737,True,sum,64,3,0.2,0.05,800,600,0.000706118378823584,3,10,COMPLETE
90,0.006123277555133171,0.6432134509086609,2024-12-19 23:10:06.375859,2024-12-19 23:17:32.100637,0 days 00:07:25.724778,True,norm,32,3,0.2,0.0,800,1000,0.0008736284436636797,4,5,COMPLETE
91,0.6077342798999732,0.39252471923828125,2024-12-19 23:17:32.104838,2024-12-19 23:26:58.779021,0 days 00:09:26.674183,True,norm,64,3,0.30000000000000004,0.05,900,200,0.0008310351057503694,1,8,COMPLETE
92,0.6054228573708381,0.3952288329601288,2024-12-19 23:26:58.781080,2024-12-19 23:34:48.075274,0 days 00:07:49.294194,True,norm,64,3,0.15000000000000002,0.05,800,400,0.00047505014352505716,3,5,COMPLETE
93,0.2936140216052209,0.5353217720985413,2024-12-19 23:34:48.098776,2024-12-19 23:44:15.141733,0 days 00:09:27.042957,True,sum,16,3,0.25,0.0,700,300,0.0003160527343316206,5,4,COMPLETE
94,0.6732133414967506,0.360306978225708,2024-12-19 23:44:15.144402,2024-12-19 23:56:00.448785,0 days 00:11:45.304383,False,mean,64,3,0.15000000000000002,0.25,900,500,0.0005267230298441924,1,5,COMPLETE
95,0.5345523290180175,0.4227089583873749,2024-12-19 23:56:00.450882,2024-12-20 00:05:33.845618,0 days 00:09:33.394736,True,norm,128,4,0.5,0.0,800,500,0.0009345323577557341,3,3,COMPLETE
96,0.5154315875350414,0.49740496277809143,2024-12-20 00:05:33.847698,2024-12-20 00:13:31.695227,0 days 00:07:57.847529,True,norm,32,3,0.2,0.35000000000000003,900,400,0.0005790127837587333,2,6,COMPLETE
97,0.6054441398362155,0.44184568524360657,2024-12-20 00:13:31.725145,2024-12-20 00:24:28.343458,0 days 00:10:56.618313,False,mean,64,3,0.25,0.5,900,500,0.0005231353593938498,2,5,COMPLETE
98,0.6247281617007038,0.37829121947288513,2024-12-20 00:24:28.349786,2024-12-20 00:33:32.496850,0 days 00:09:04.147064,True,norm,64,3,0.45,0.05,700,700,0.0008071674599933719,2,9,COMPLETE
99,0.41079984215639903,0.48112547397613525,2024-12-20 00:33:32.556919,2024-12-20 00:47:19.363251,0 days 00:13:46.806332,False,mean,64,3,0.2,0.25,800,1400,0.00041121261098874516,2,4,COMPLETE
