number,values_0,values_1,datetime_start,datetime_complete,duration,params_BN,params_aggregation,params_batch_size,params_depth,params_dropout_bond,params_dropout_ffn,params_hidden_bond,params_hidden_ffn,params_init_lr,params_layer,params_warmup_epochs,state
0,0.3510305218264924,0.40203234553337097,2024-12-20 00:47:20.826413,2024-12-20 00:56:27.571877,0 days 00:09:06.745464,True,norm,32,5,0.35000000000000003,0.0,100,1300,0.0001473599540365631,1,9,COMPLETE
1,0.24575420215237942,0.4417476952075958,2024-12-20 00:56:27.574945,2024-12-20 01:07:17.585152,0 days 00:10:50.010207,False,norm,128,1,0.35000000000000003,0.5,300,1100,0.0006019805050747758,1,2,COMPLETE
2,0.23683863205252498,0.4446296691894531,2024-12-20 01:07:17.593577,2024-12-20 01:15:20.499134,0 days 00:08:02.905557,True,sum,64,2,0.05,0.15000000000000002,900,400,0.00031460076804621615,5,8,COMPLETE
3,0.359737876314725,0.3755016326904297,2024-12-20 01:15:20.551374,2024-12-20 01:24:07.550629,0 days 00:08:46.999255,True,norm,64,4,0.45,0.1,300,700,0.0003932277765141166,2,7,COMPLETE
4,0.4071320835079691,0.40813615918159485,2024-12-20 01:24:07.559434,2024-12-20 01:35:11.980208,0 days 00:11:04.420774,False,mean,32,4,0.25,0.5,700,1100,0.00028790988211953696,1,3,COMPLETE
5,0.3141819625189947,0.41702428460121155,2024-12-20 01:35:11.983268,2024-12-20 01:46:58.150954,0 days 00:11:46.167686,False,sum,64,3,0.25,0.35000000000000003,200,100,0.0009737940983867228,4,2,COMPLETE
6,0.354927551113909,0.39839085936546326,2024-12-20 01:46:58.154206,2024-12-20 01:56:58.020721,0 days 00:09:59.866515,True,sum,32,3,0.15000000000000002,0.5,100,1600,0.00032918851131067827,1,5,COMPLETE
7,0.38148401443587926,0.43501532077789307,2024-12-20 01:56:58.022953,2024-12-20 02:05:23.611403,0 days 00:08:25.588450,False,norm,64,4,0.35000000000000003,0.2,400,1000,0.0004624094282255391,1,4,COMPLETE
8,0.32432090296247096,0.4066678285598755,2024-12-20 02:05:23.614719,2024-12-20 02:13:11.001984,0 days 00:07:47.387265,True,sum,64,3,0.30000000000000004,0.35000000000000003,200,1700,0.00014213297591955714,1,4,COMPLETE
9,0.17568710542233662,0.5026934742927551,2024-12-20 02:13:11.005531,2024-12-20 02:20:35.945047,0 days 00:07:24.939516,True,mean,128,3,0.45,0.2,800,600,0.0002031910684034785,4,9,COMPLETE
10,,,2024-12-20 02:20:36.026102,2024-12-20 02:30:20.911129,0 days 00:09:44.885027,False,mean,16,5,0.0,0.35000000000000003,600,2000,0.0002272749607673652,3,6,FAIL
11,,,2024-12-20 02:30:20.962636,2024-12-20 02:43:09.572292,0 days 00:12:48.609656,False,mean,16,5,0.0,0.35000000000000003,600,2000,0.00010753301096560183,3,6,FAIL
12,,,2024-12-20 02:43:09.642652,2024-12-20 02:52:17.182421,0 days 00:09:07.539769,False,mean,16,5,0.0,0.35000000000000003,600,1400,0.00010857307786209266,3,6,FAIL
13,,,2024-12-20 02:52:17.187137,2024-12-20 03:01:08.895174,0 days 00:08:51.708037,False,mean,16,5,0.0,0.35000000000000003,600,2000,0.00010327353478605177,3,6,FAIL
14,,,2024-12-20 03:01:08.954698,2024-12-20 03:11:03.930562,0 days 00:09:54.975864,False,mean,16,5,0.0,0.35000000000000003,600,2000,0.00010296779173809618,3,6,FAIL
15,,,2024-12-20 03:11:03.993356,2024-12-20 03:19:52.200288,0 days 00:08:48.206932,False,mean,16,5,0.0,0.35000000000000003,600,1400,0.00022439958900288517,3,6,FAIL
16,,,2024-12-20 03:19:52.240245,2024-12-20 03:31:17.347036,0 days 00:11:25.106791,False,mean,16,5,0.0,0.35000000000000003,600,2000,0.00010284844493729868,3,6,FAIL
17,,,2024-12-20 03:31:17.405370,2024-12-20 03:40:50.952965,0 days 00:09:33.547595,False,mean,16,5,0.0,0.35000000000000003,600,2000,0.0002284071882429193,3,6,FAIL
18,,,2024-12-20 03:40:50.956617,2024-12-20 03:50:34.119560,0 days 00:09:43.162943,False,mean,16,5,0.0,0.35000000000000003,600,2000,0.00010368924024898821,3,6,FAIL
19,,,2024-12-20 03:50:34.189449,2024-12-20 04:03:55.784384,0 days 00:13:21.594935,False,mean,16,5,0.15000000000000002,0.35000000000000003,600,2000,0.0002122497625817573,3,6,FAIL
20,,,2024-12-20 04:03:55.841040,2024-12-20 04:17:38.724437,0 days 00:13:42.883397,False,mean,16,5,0.0,0.35000000000000003,600,1900,0.0002247316847126776,3,6,FAIL
21,,,2024-12-20 04:17:38.729175,2024-12-20 04:28:27.934853,0 days 00:10:49.205678,False,mean,16,5,0.0,0.35000000000000003,600,1900,0.00021771380600799564,3,6,FAIL
22,,,2024-12-20 04:28:27.996205,2024-12-20 04:39:58.850098,0 days 00:11:30.853893,False,mean,16,5,0.0,0.35000000000000003,600,2000,0.00010156267016540939,3,6,FAIL
23,,,2024-12-20 04:39:58.900205,2024-12-20 04:50:16.047716,0 days 00:10:17.147511,False,mean,16,5,0.15000000000000002,0.35000000000000003,700,2000,0.0001147377404195324,3,6,FAIL
24,,,2024-12-20 04:50:16.053754,2024-12-20 05:01:34.617067,0 days 00:11:18.563313,False,mean,16,5,0.15000000000000002,0.35000000000000003,600,1900,0.00022090914248928834,3,6,FAIL
25,,,2024-12-20 05:01:34.675214,2024-12-20 05:15:24.935000,0 days 00:13:50.259786,False,mean,16,5,0.0,0.35000000000000003,600,2000,0.00022400572281255267,3,6,FAIL
26,,,2024-12-20 05:15:24.939876,2024-12-20 05:24:44.074968,0 days 00:09:19.135092,False,mean,16,5,0.0,0.35000000000000003,600,2000,0.0001061875807644812,3,6,FAIL
27,,,2024-12-20 05:24:44.133247,2024-12-20 05:32:50.144398,0 days 00:08:06.011151,False,mean,16,5,0.0,0.35000000000000003,600,1900,0.00010719688381649131,3,6,FAIL
28,,,2024-12-20 05:32:50.218213,2024-12-20 05:43:45.432127,0 days 00:10:55.213914,False,mean,16,5,0.15000000000000002,0.35000000000000003,600,1900,0.00022132853281866394,3,6,FAIL
29,,,2024-12-20 05:43:45.489995,2024-12-20 05:52:06.873412,0 days 00:08:21.383417,False,mean,16,5,0.15000000000000002,0.4,600,2000,0.00010334163656848877,3,6,FAIL
30,0.019709777139370412,0.5680860877037048,2024-12-20 05:52:06.878194,2024-12-20 06:00:51.630896,0 days 00:08:44.752702,False,mean,16,5,0.0,0.35000000000000003,600,2000,0.00022318808026183204,3,6,COMPLETE
31,0.3526019326649789,0.42434579133987427,2024-12-20 06:00:51.638413,2024-12-20 06:10:25.752499,0 days 00:09:34.114086,False,mean,32,4,0.5,0.05,600,900,0.00011033506294694118,2,7,COMPLETE
32,0.5936702432767378,0.29848408699035645,2024-12-20 06:10:25.809364,2024-12-20 06:19:19.093630,0 days 00:08:53.284266,False,mean,32,4,0.2,0.1,700,700,0.00030380608552462845,2,4,COMPLETE
33,0.41613704495377385,0.385860413312912,2024-12-20 06:19:19.096717,2024-12-20 06:27:15.610978,0 days 00:07:56.514261,False,mean,32,1,0.15000000000000002,0.0,800,200,0.00024855337111009306,3,4,COMPLETE
34,0.31474709541029117,0.40485838055610657,2024-12-20 06:27:15.615652,2024-12-20 06:38:44.246299,0 days 00:11:28.630647,False,mean,16,1,0.15000000000000002,0.0,1000,300,0.0005076216134234556,3,5,COMPLETE
35,0.3895073507270997,0.3857956528663635,2024-12-20 06:38:44.254866,2024-12-20 06:47:20.327446,0 days 00:08:36.072580,False,mean,32,5,0.15000000000000002,0.1,500,700,0.00022520800017186148,2,4,COMPLETE
36,,,2024-12-20 06:47:20.362423,2024-12-20 06:56:27.670784,0 days 00:09:07.308361,False,mean,32,2,0.1,0.25,800,1400,0.000620025474720005,3,10,FAIL
37,,,2024-12-20 06:56:27.733536,2024-12-20 07:09:30.378713,0 days 00:13:02.645177,False,mean,32,2,0.1,0.30000000000000004,800,1400,0.0006997121104601017,3,10,FAIL
38,0.36203716274209097,0.40439993143081665,2024-12-20 07:09:30.381440,2024-12-20 07:20:19.123456,0 days 00:10:48.742016,False,mean,32,2,0.1,0.25,800,400,0.0006664875450260262,3,10,COMPLETE
39,,,2024-12-20 07:20:19.129640,2024-12-20 07:32:00.692248,0 days 00:11:41.562608,False,mean,16,2,0.2,0.1,700,1300,0.0004101805035027831,2,3,FAIL
40,0.34348290599496534,0.3953876495361328,2024-12-20 07:32:00.695191,2024-12-20 07:42:25.338263,0 days 00:10:24.643072,False,mean,128,2,0.2,0.1,700,1400,0.0004091492163236153,2,3,COMPLETE
41,,,2024-12-20 07:42:25.388578,2024-12-20 07:53:57.419907,0 days 00:11:32.031329,False,mean,16,4,0.0,0.30000000000000004,1000,100,0.00026903002555405325,4,6,FAIL
42,0.33948996733315606,0.42147576808929443,2024-12-20 07:53:57.446433,2024-12-20 08:06:56.953759,0 days 00:12:59.507326,False,mean,16,4,0.0,0.30000000000000004,500,100,0.0002549791702957768,4,6,COMPLETE
43,,,2024-12-20 08:06:56.957971,2024-12-20 08:14:32.194605,0 days 00:07:35.236634,False,mean,32,5,0.2,0.2,1000,800,0.00018403748079572364,5,3,FAIL
44,,,2024-12-20 08:14:32.241320,2024-12-20 08:22:27.947487,0 days 00:07:55.706167,False,mean,32,5,0.2,0.2,1000,800,0.0003386401551082046,5,3,FAIL
45,,,2024-12-20 08:22:28.000244,2024-12-20 08:31:35.239391,0 days 00:09:07.239147,False,mean,32,5,0.2,0.2,1000,800,0.00018018297192091688,5,3,FAIL
46,,,2024-12-20 08:31:35.291429,2024-12-20 08:41:11.775157,0 days 00:09:36.483728,False,mean,32,5,0.2,0.2,1000,800,0.00018503782740054474,5,3,FAIL
47,,,2024-12-20 08:41:11.820632,2024-12-20 08:49:34.666456,0 days 00:08:22.845824,False,mean,32,5,0.1,0.05,1000,800,0.0001913275850443477,5,3,FAIL
48,,,2024-12-20 08:49:34.668934,2024-12-20 08:59:09.020241,0 days 00:09:34.351307,False,mean,32,5,0.2,0.2,1000,900,0.00019262520728655753,5,3,FAIL
49,,,2024-12-20 08:59:09.071314,2024-12-20 09:09:28.810382,0 days 00:10:19.739068,False,mean,32,5,0.2,0.2,1000,900,0.0003603862253571902,5,3,FAIL
50,,,2024-12-20 09:09:28.871344,2024-12-20 09:19:40.901355,0 days 00:10:12.030011,False,mean,32,5,0.1,0.2,1000,800,0.00018315868482187968,5,3,FAIL
51,0.005527511593829217,0.5356767177581787,2024-12-20 09:19:40.905444,2024-12-20 09:27:25.048465,0 days 00:07:44.143021,False,mean,32,5,0.2,0.2,1000,800,0.0001888300647924189,5,3,COMPLETE
52,0.6502207659744841,0.2726164758205414,2024-12-20 09:27:25.053041,2024-12-20 09:35:50.940964,0 days 00:08:25.887923,False,norm,32,4,0.1,0.05,800,500,0.000357814873152897,2,5,COMPLETE
53,0.703102228593458,0.25044897198677063,2024-12-20 09:35:50.947796,2024-12-20 09:44:24.647673,0 days 00:08:33.699877,False,norm,32,4,0.05,0.05,800,500,0.0003392945489609253,2,5,COMPLETE
54,0.688788465972176,0.2619516849517822,2024-12-20 09:44:24.650149,2024-12-20 09:52:46.521791,0 days 00:08:21.871642,False,norm,32,4,0.05,0.05,900,500,0.0003418720640050733,2,6,COMPLETE
55,0.7345501966902026,0.2648089528083801,2024-12-20 09:52:46.525445,2024-12-20 10:01:13.052248,0 days 00:08:26.526803,True,norm,128,3,0.05,0.05,900,500,0.00038217747465052807,2,7,COMPLETE
56,0.5093879629638587,0.4322151243686676,2024-12-20 10:01:13.056649,2024-12-20 10:08:42.422627,0 days 00:07:29.365978,True,norm,128,3,0.05,0.05,900,500,0.0003830906967491645,3,7,COMPLETE
57,0.6316959831263946,0.28043699264526367,2024-12-20 10:08:42.471875,2024-12-20 10:17:38.286496,0 days 00:08:55.814621,True,norm,128,2,0.05,0.15000000000000002,900,300,0.00047522409562555874,2,8,COMPLETE
58,0.6976250013754628,0.2713663578033447,2024-12-20 10:17:38.350422,2024-12-20 10:28:18.238556,0 days 00:10:39.888134,True,norm,128,3,0.0,0.15000000000000002,1000,900,0.0002943385303932597,2,6,COMPLETE
59,0.4861472398930909,0.3451944589614868,2024-12-20 10:28:18.294000,2024-12-20 10:35:21.842603,0 days 00:07:03.548603,True,norm,128,3,0.1,0.05,900,500,0.00035005880462358997,3,8,COMPLETE
60,0.40287939639783293,0.519666314125061,2024-12-20 10:35:21.845852,2024-12-20 10:46:56.852757,0 days 00:11:35.006905,True,norm,16,2,0.05,0.4,700,1300,0.0002733431790819059,2,7,COMPLETE
61,0.39395007481094924,0.4744119346141815,2024-12-20 10:46:56.857141,2024-12-20 10:55:21.414047,0 days 00:08:24.556906,True,norm,128,5,0.1,0.0,600,1300,0.00016582473006324444,1,10,COMPLETE
62,0.6486169607758938,0.36684340238571167,2024-12-20 10:55:21.460818,2024-12-20 11:03:54.290934,0 days 00:08:32.830116,True,norm,128,4,0.0,0.25,1000,300,0.00024998210826454283,3,5,COMPLETE
63,0.7405767110234964,0.27153849601745605,2024-12-20 11:03:54.292851,2024-12-20 11:15:38.241064,0 days 00:11:43.948213,True,norm,128,3,0.0,0.15000000000000002,1000,900,0.0003124507637916243,2,6,COMPLETE
64,0.5127677644526544,0.3777446746826172,2024-12-20 11:15:38.289851,2024-12-20 11:22:31.826203,0 days 00:06:53.536352,False,norm,32,5,0.05,0.0,400,600,0.0006088389847410332,2,6,COMPLETE
65,,,2024-12-20 11:22:31.829675,2024-12-20 11:32:12.117459,0 days 00:09:40.287784,False,norm,32,4,0.4,0.05,900,2000,0.0003203231563609372,4,5,FAIL
66,,,2024-12-20 11:32:12.121529,2024-12-20 11:41:46.293087,0 days 00:09:34.171558,False,norm,32,4,0.4,0.05,900,1100,0.0003272897801858135,4,5,FAIL
67,,,2024-12-20 11:41:46.348079,2024-12-20 11:50:13.740042,0 days 00:08:27.391963,False,norm,32,4,0.4,0.05,900,2000,0.0003239557282368688,4,5,FAIL
68,0.089157437464034,0.4873347282409668,2024-12-20 11:50:13.825622,2024-12-20 12:06:06.249198,0 days 00:15:52.423576,False,norm,32,4,0.05,0.05,900,1100,0.0003151330817490245,4,5,COMPLETE
69,,,2024-12-20 12:06:06.275508,2024-12-20 12:17:03.369635,0 days 00:10:57.094127,False,sum,32,3,0.4,0.15000000000000002,800,1900,0.0004164008648427699,1,6,FAIL
70,,,2024-12-20 12:17:03.374920,2024-12-20 12:25:35.044088,0 days 00:08:31.669168,False,sum,32,3,0.35000000000000003,0.15000000000000002,800,800,0.0001006186299531427,1,6,FAIL
71,,,2024-12-20 12:25:35.071124,2024-12-20 12:33:36.787182,0 days 00:08:01.716058,False,sum,32,3,0.0,0.15000000000000002,800,2000,0.00041724777227570106,1,6,FAIL
72,,,2024-12-20 12:33:36.834113,2024-12-20 12:43:34.349824,0 days 00:09:57.515711,False,sum,32,3,0.4,0.15000000000000002,800,2000,0.0004295614706826283,1,6,FAIL
73,,,2024-12-20 12:43:34.362332,2024-12-20 12:52:14.666656,0 days 00:08:40.304324,False,sum,32,3,0.4,0.15000000000000002,800,800,0.00040786344851463934,1,6,FAIL
74,,,2024-12-20 12:52:14.670571,2024-12-20 13:00:37.173682,0 days 00:08:22.503111,False,sum,32,3,0.4,0.15000000000000002,800,2000,0.0004268644782231473,1,6,FAIL
75,,,2024-12-20 13:00:37.185046,2024-12-20 13:10:20.513819,0 days 00:09:43.328773,False,sum,32,3,0.4,0.15000000000000002,900,1900,0.00038295511461646875,1,6,FAIL
76,,,2024-12-20 13:10:20.562184,2024-12-20 13:20:12.300597,0 days 00:09:51.738413,False,sum,32,3,0.4,0.15000000000000002,800,800,0.00010355407539847469,1,6,FAIL
77,,,2024-12-20 13:20:12.358492,2024-12-20 13:30:36.271242,0 days 00:10:23.912750,False,sum,32,3,0.35000000000000003,0.15000000000000002,800,800,0.0004197827316655714,1,6,FAIL
78,,,2024-12-20 13:30:36.275794,2024-12-20 13:42:11.974270,0 days 00:11:35.698476,False,sum,32,3,0.35000000000000003,0.15000000000000002,800,2000,0.00041432151829378234,1,6,FAIL
79,,,2024-12-20 13:42:11.976637,2024-12-20 13:51:52.508591,0 days 00:09:40.531954,False,sum,32,3,0.4,0.15000000000000002,800,1900,0.00038224311446427946,1,6,FAIL
80,,,2024-12-20 13:51:52.562965,2024-12-20 14:00:13.072310,0 days 00:08:20.509345,False,sum,32,3,0.35000000000000003,0.15000000000000002,800,2000,0.00010037201713494648,1,6,FAIL
81,,,2024-12-20 14:00:13.121387,2024-12-20 14:10:04.718811,0 days 00:09:51.597424,False,sum,32,3,0.4,0.15000000000000002,800,2000,0.0004227958019999146,1,6,FAIL
82,,,2024-12-20 14:10:04.722847,2024-12-20 14:24:15.767793,0 days 00:14:11.044946,False,sum,32,3,0.0,0.15000000000000002,800,1900,0.00043801064180430107,1,6,FAIL
83,,,2024-12-20 14:24:15.792950,2024-12-20 14:32:52.015882,0 days 00:08:36.222932,False,sum,32,3,0.35000000000000003,0.15000000000000002,800,800,0.00010074169040834858,1,6,FAIL
84,,,2024-12-20 14:32:52.067984,2024-12-20 14:44:52.167313,0 days 00:12:00.099329,False,sum,32,3,0.4,0.15000000000000002,800,800,0.00040453567944458596,1,6,FAIL
85,,,2024-12-20 14:44:52.232472,2024-12-20 14:57:02.051294,0 days 00:12:09.818822,False,sum,32,3,0.0,0.15000000000000002,800,800,0.00041638996100170326,1,6,FAIL
86,0.07594160219964928,3.9988412857055664,2024-12-20 14:57:02.054572,2024-12-20 15:07:51.430425,0 days 00:10:49.375853,False,sum,32,3,0.4,0.15000000000000002,800,2000,0.0004033092266896099,1,6,COMPLETE
87,0.10156301311404829,0.5107958912849426,2024-12-20 15:07:51.432878,2024-12-20 15:19:10.598608,0 days 00:11:19.165730,True,norm,16,4,0.0,0.45,400,400,0.00010462734900783918,5,9,COMPLETE
88,0.548329471340593,0.32294854521751404,2024-12-20 15:19:10.669510,2024-12-20 15:29:13.381835,0 days 00:10:02.712325,False,norm,64,4,0.1,0.1,700,800,0.00033488536511177945,2,2,COMPLETE
89,0.1841153551689614,0.4696994721889496,2024-12-20 15:29:13.448216,2024-12-20 15:37:36.350306,0 days 00:08:22.902090,False,sum,32,1,0.30000000000000004,0.1,100,1800,0.0007728996907278393,1,5,COMPLETE
90,0.5005322968824755,0.3471790552139282,2024-12-20 15:37:36.354713,2024-12-20 15:47:09.494815,0 days 00:09:33.140102,True,norm,64,5,0.25,0.05,300,600,0.00045854436312690595,1,8,COMPLETE
91,0.1394673153600042,0.47900012135505676,2024-12-20 15:47:09.497393,2024-12-20 15:58:28.066230,0 days 00:11:18.568837,False,sum,32,3,0.1,0.15000000000000002,500,200,0.0005310561951429622,2,7,COMPLETE
92,0.3545444029202745,0.3926268517971039,2024-12-20 15:58:28.068998,2024-12-20 16:11:16.475063,0 days 00:12:48.406065,True,norm,64,2,0.4,0.45,900,1500,0.0002899709689714717,3,3,COMPLETE
93,0.7684460230387108,0.25002604722976685,2024-12-20 16:11:16.509947,2024-12-20 16:23:15.546475,0 days 00:11:59.036528,True,norm,128,3,0.0,0.15000000000000002,1000,900,0.00036833132240423456,2,6,COMPLETE
94,0.2375012829793892,0.46317026019096375,2024-12-20 16:23:15.572092,2024-12-20 16:35:16.734361,0 days 00:12:01.162269,True,sum,128,2,0.0,0.30000000000000004,1000,1200,0.0004195861850338302,4,6,COMPLETE
95,0.08121488315923361,0.5246315598487854,2024-12-20 16:35:16.738448,2024-12-20 16:47:14.086168,0 days 00:11:57.347720,True,norm,128,3,0.5,0.2,1000,1000,0.0003711908977507817,5,7,COMPLETE
96,0.37616906587867294,0.39393287897109985,2024-12-20 16:47:14.152893,2024-12-20 16:57:09.043627,0 days 00:09:54.890734,True,norm,128,2,0.05,0.30000000000000004,200,900,0.00011900789970175687,1,8,COMPLETE
97,0.3219483096185893,0.4093358516693115,2024-12-20 16:57:09.115624,2024-12-20 17:06:37.716950,0 days 00:09:28.601326,True,sum,128,1,0.0,0.2,900,1100,0.0009024466694621094,1,2,COMPLETE
98,0.3209501225293079,0.39564207196235657,2024-12-20 17:06:37.739771,2024-12-20 17:14:54.760231,0 days 00:08:17.020460,True,norm,128,3,0.0,0.25,1000,800,0.0005408957012492322,4,7,COMPLETE
99,0.5140363951558254,0.32848119735717773,2024-12-20 17:14:54.764524,2024-12-20 17:26:09.519277,0 days 00:11:14.754753,True,sum,128,2,0.30000000000000004,0.25,1000,1200,0.0003216292331864777,3,9,COMPLETE
